73124610321,St Francis Xavier Primary School,VIC,3199,Large,Y,,,,Y,,,,,,,Y,,,,,,Y,,,,,,,,,,,,,,,Y,,,,,,,
73128090237,LIQUID ARCHITECTURE SOUND INC,VIC,3066,Medium,Y,,,Y,,,,,,,,,,,,,,,,,,,,,,Y,,,,,,,,,,,,,,
73132759525,Australia and New Zealand Sarcoma Association Limited,VIC,3000,Large,,,,,,,,,,,,,,,,Y,Y,Y,,Y,,Y,,,,,,,,Y,,,,,,,,,,Y
73134802658,Hope From Above Incorporated,VIC,3137,Medium,Y,,,,Y,Y,,,,,,Y,,,,,,,Y,,,,,,,,,,,,,,,,,,,,,
73141187677,The Trustee For The Korowa Foundation Endowment Fund,VIC,3146,Small,Y,,,,Y,,,,,,,,,,,,,Y,,Y,,,Y,,,,,,,,,,,,,,,,,Y
73150930310,Melbourne West Korean Church,VIC,3030,Small,Y,,,,,,,,,,,Y,,,,,,,,,Y,Y,,,,Y,,,,,,,,,,,,,,
73157919362,MONTMORENCY RSL SUB-BRANCH PATRIOTIC FUND,VIC,3000,Small,Y,,,,,Y,,,,,,,Y,Y,,,,,,,,,,,,,,,,,,,,,,,Y,,,
73159303161,Dogs For Kids With Disabilities Limited,VIC,3199,Medium,Y,Y,,,,,,,,,,,Y,,,,,Y,,Y,,Y,Y,,,Y,Y,,,,,Y,Y,,,,,,,Y
73182695868,Sacred Heart Regional Girls College,VIC,3166,Large,Y,,,,Y,,,,,,,Y,,,,,,Y,,,,,,,,,,,,,,,Y,,,,,,,Y
73183496877,Lang Lang RSL Sub-Branch Patriotic Fund,VIC,3000,Small,Y,,,,,Y,,,,,,,Y,Y,,,,,,,,,,,,,,,,,,,,,,,Y,,,
73247337843,Holy Eucharist Catholic Church St Albans South,VIC,3021,Small,Y,,,,,,,,,,,Y,,,,,,,,,,,,,,Y,,,,,,,,,,,,,,
73247349377,Bardas Foundation,VIC,3141,Small,Y,,,Y,,Y,,,,Y,,,Y,,,,,,,,,,,,,Y,,,,,,,,,,,,,,
73283234359,Portarlington Pre-School Incorporated,VIC,3223,,Y,,,,Y,,,,,,,,,,Y,,,,,,,,,,,,,,,,,,,,,,,,,
73288998195,Central Highlands Group Training Incorporated,VIC,3350,Large,Y,Y,,,,,,,,,,,,,Y,Y,,,,,Y,,Y,Y,Y,,Y,Y,,,Y,,Y,Y,Y,Y,Y,Y,Y,Y
73362892292,Sebastopol Rsl Sub-Branch,VIC,3356,Small,Y,,,,,,,,,Y,,,,,,,,,,,,,,,,Y,,,,,,,,,,,,,,
73418859933,PHILLIP ISLAND RSL SUB-BRANCH PATRIOTIC FUND,VIC,3000,Medium,Y,,,,,Y,,,,,,,Y,Y,,,,,,,,,,,,,,,,,,,,,,,Y,,,
73433055269,Our Lady Of The Pines School Donvale,VIC,3111,Large,Y,,,,Y,,,,,,,Y,,,,,,Y,,,,,,,,,,,,,,,Y,,,,,,,
73464089868,St Gregory The Great Catholic Church,VIC,3108,Small,Y,,,,,,,,,,,Y,,,,,,,,,,,,,,Y,,,,,,,,,,,,,,
73474839212,St John's Healesville With St Paul's Yarra Glen Anglican Churches,VIC,3777,Small,Y,,,,,,,,,,,Y,,,,,,,,,,,,,,Y,,,,,,,,,,,,,,
73533014664,Patron of the Noise,VIC,3185,Small,Y,,,Y,,,,,,,,,,,,,,,,,,,,,,Y,,,,,,,,,,,,,,
73538102253,Red Cliffs-Irymple RSL Sub-Branch Welfare Patriotic Fund W341,VIC,3000,Small,Y,,,,,,,,,,,,Y,Y,,,,,,,,,,,,,,,,,,,,,,,Y,,,
73543836491,St Margaret Mary's Catholic Church Spotswood,VIC,3015,Small,Y,,,,,,,,,,,Y,,,,,,,,,,,,,,Y,,,,,,,,,,,,,,
73632054865,PAIN RESEARCH FOUNDATION LIMITED,VIC,3168,,Y,,,,,Y,,,,,,,,,,,,,,,,,,,,Y,,,,,,Y,,,,,,,,
73640287392,The Trustee for Copper Trust,VIC,3088,,Y,,,,,,,,,Y,,,,,,,,,,,,,,,,Y,,,,,,,,,,,,,,
73671987649,St Theresas Catholic Church Albion,VIC,3020,Small,Y,,,,,,,,,,,Y,,,,,,,,,,,,,,Y,,,,,,,,,,,,,,
73710361216,St Peter & Pauls School Building Fund Trust,VIC,3218,Small,Y,,,,Y,,,,,,,,,,,,,Y,,,,,,,,,,,,,,,,,,,,,,
73725578826,Melbourne Chinese Baptist Church,VIC,3101,Medium,Y,,,,,,,,,,,Y,,,,,,,,,Y,,,,,Y,,,,,,,,,,,,,,
73735632665,St Joseph's Primary School Charlton,VIC,3525,Medium,Y,,,,Y,,,,,,,Y,,,Y,,,Y,,,,,,,,,,,,,,,Y,,,,,,,Y
73782218163,The Trustee For The Susan Larter Vision Trust,VIC,3000,Small,Y,,,,,Y,,,,,,,,,,,,,,,,,,Y,,,,,,,,,,,,,,,,
73794652284,The Winged Horse Equine Welfare Inc.,VIC,3223,Small,Y,,Y,,,,,,,Y,,,,,,Y,Y,Y,,,,,Y,Y,Y,,Y,,,,,Y,Y,,Y,Y,Y,Y,,Y
73823664469,St John's Catholic Church - Kooweerup,VIC,3812,Small,Y,,,,,,,,,,,Y,,,,,,,,,,,,,,Y,,,,,,,,,,,,,,
73846428558,Fernlea Community Care Inc,VIC,3810,Large,Y,Y,,,,,,,,Y,,,,,,Y,Y,,,,,,,,,,,,,,,Y,Y,,,,,,,
73872200647,Boroondara Kindergarten Inc,VIC,3121,Medium,Y,,,,Y,,,,,,,,,,,,,,,Y,Y,,,Y,,,,Y,,,,,,,,,,,,
73879960566,Reggio Emilia Australia Information Exchange Inc,VIC,3122,Large,Y,,,,,,,,,,,,,,,,,Y,,Y,,,,,,Y,,,,,,,,,,,,,,
73905964174,Mount Waverley Christadelphian Ecclesia Inc,VIC,3149,Small,Y,,,,,,,,,,,Y,,,,,,,,,,Y,,,,,,,,,,,,,,,,,,
73919601048,Yeshivah Shul Kiddush Benevolent Inc,VIC,3183,,Y,Y,,,,,,,,,,,Y,,,,,,,,,,,,,,,,,,,,,,,,,,,
73926475237,Victorian Inmigrant And Refugee Womens Coalition Incorporated,VIC,3053,Small,Y,Y,,,,,,,,,,,,,,Y,Y,,,,,,Y,,,Y,,Y,,,Y,,Y,,,,,Y,Y,Y
73941765364,Returned & Services League of Australia (Victorian Branch) Inc.,VIC,3000,Large,Y,,,,,,,,,Y,,,Y,Y,,,,,,,,,,,,,,,,,,,,,,,Y,,,
73959831658,Holy Trinity Anglican Church Hampton Park,VIC,3976,Small,,,,,,,,,,,,Y,,,,,,,,,,,,,,,,,,,,,,,,,,,,
73980913890,Dorothy Bailey House Project,VIC,3152,,,Y,,,,,,,,,,,,,,,Y,,,,,,,,,,,,,,,,,,,,,,,
74050662368,The Australasian College Of Behavioural Optometrists Incorporated,VIC,3000,Medium,Y,,,,,Y,,,,,,,,,,,,,,,,,,,,Y,,,,,,,,,,,,,,
74052124375,Environmental Justice Australia,VIC,8006,Large,,,,,,,Y,Y,,,,,,,,,,,,,,,,,,Y,,,,,,,,,,,,,,
74109600302,Innovation & Business Industry Skills Council Ltd,VIC,3002,Large,Y,,,,Y,,,,,,,,,,,,,,,,,,Y,,,Y,Y,,,,,,,,,,,,,
74114857147,St Josephs College Newtown,VIC,3220,Large,,,,,Y,,,,,,,Y,,,Y,,,,Y,,,,,,,Y,,,,Y,,,Y,,,,,,,
74125947499,Ethiopiaid Australia Ltd,VIC,3004,Small,Y,,,,,,,,,,,,Y,,,Y,,Y,Y,,,Y,Y,Y,,,,,,Y,Y,,,,Y,,,,,Y
74134656107,Pangea Global Health Education Limited,VIC,3050,Small,,,,,,Y,,,,,,,,,,,,,Y,,,,,,,,,,,,,,,,,,,,,
74172612400,The Williams Family Scholarship Trust,VIC,3294,Small,Y,,,,Y,,,,,,,,,,,,,Y,,,,,,,,,,,,,,,,,Y,,,,,
74245457233,Diamond Creek RSL Sub-Branch Patriotic Fund,VIC,3000,Small,Y,,,,,Y,,,,,,,Y,Y,,,,,,,,,,,,,,,,,,,,,,,Y,,,
74252955964,Catholic Women's League Of Victoria & Wagga Mary Glowrey House,VIC,3065,,Y,,,,,,,,,,,Y,,,Y,,Y,Y,,,,,Y,,,Y,Y,Y,Y,,,Y,Y,,,,,,Y,Y
74265832713,The Trustee For The Gray Family Charitable Trust,VIC,3000,Small,Y,,,,,,,,,,,,,,,,,,,,,Y,,,,,,,,,Y,,,,,,,,,
74275063688,The Southern Metropolitan Cemeteries Trust,VIC,3171,Large,Y,,,,,,,,,Y,,,,,,,,,,,,,,,,Y,,,,,,,,,,,,,,
74283627522,St Augustine's Outreach Services Incorporated,VIC,3194,Small,Y,Y,,,,,,,,,,,,,,,,,,,,Y,,,,,,,,,,,,,,,,,,
74317181426,Siena Catholic Primary School,VIC,3350,Large,Y,,,,Y,,,,,,,Y,,,Y,,,Y,,,,,,,,,,,,,,,Y,,,,,,,Y
74325417506,HOSANNA FAITH CHRISTIAN CHURCH,VIC,3977,,Y,,,,,,,,,,,Y,,,,,,,,,Y,,,,,Y,,Y,,,,,,,,,,,,
74330298517,St Monica's Catholic Church Footscray,VIC,3011,Small,Y,,,,,,,,,,,Y,,,,,,,,,,,,,,Y,,,,,,,,,,,,,,
74357745481,St Mary's Primary School Mooroopna,VIC,3629,Large,Y,,,,Y,,,,,,,Y,,,,,,Y,,,,,,,,,,,,,,,,,,,,,,
74426214829,Baw Baw Neighbourhood Watch Inc,VIC,3821,Small,Y,,,,,,,,,,,,,Y,,,,,,,,Y,,,,Y,,,Y,,,,,,,,,,,
74453482885,Lavalla Catholic College,VIC,3844,Large,Y,,,,Y,,,,,,,Y,,,,,,Y,,,,,,,,,,,,,,,,,,,,,,Y
74529506294,St Joachim's Primary School,VIC,3201,Large,Y,,,,Y,,,,,,,Y,,,,,,Y,,,,,,,,,,,,,,,Y,,,,,,,
74542918323,Malvern Community Child Carecooperative Ltd,VIC,3143,Medium,Y,,,,Y,,,,,,,,,,,,,,,Y,,,,,,,,,,,,,,,,,,,,
74559523285,UCA - Timboon Congregation,VIC,3268,Small,Y,,,,,,,,,,,Y,,,,,,,,,,,,,,Y,,,,,,,,,,,,,,
74577483345,Our Lady Of Lourdes Catholic Church Bayswater,VIC,3153,Small,Y,,,,,,,,,,,Y,,,,,,,,,,,,,,Y,,,,,,,,,,,,,,
74580649688,Sharp H R Bequest,VIC,3000,Small,Y,,,,,,,,,,,Y,,,,,,,,,,,,,,Y,,,,,,,,,,,,,,
74585311310,St Marys Catholic Church Dandenong,VIC,3175,Medium,Y,,,,,,,,,,,Y,,,,,,,,,,,,,,Y,,,,,,,,,,,,,,
74610219246,McCormack Housing Limited,VIC,3121,,Y,Y,,,,,,,,,,,Y,,,,,,,,,,,,,,,,,,Y,,Y,Y,,Y,,,,
74614366031,Karingal St Laurence Limited,VIC,3216,,Y,Y,,,,,,,,,,,Y,,,,Y,,,,,,,,,,,,,,,Y,Y,,,Y,,,,
74624700821,Zodiak Holdings Pty. Ltd.,VIC,3004,,Y,,,,,,,,,Y,,,,,,,,,,,,,,,,Y,,,,,,Y,,,,,,,,
74632397160,Ss Peter & Paul's Catholic Church Doncaster East,VIC,3109,Small,Y,,,,,,,,,,,Y,,,,,,,,,,,,,,Y,,,,,,,,,,,,,,
74642498600,THE XFACTOR COLLECTIVE FOUNDATION LTD,VIC,3016,,Y,,,,,,,,,,,,Y,,,Y,,,,,,,,,,,,,Y,,,,,,,,,,,
74702845036,Barraport Boort Baptist Church,VIC,3537,Small,Y,,,,,,,,,,,Y,,,,,,,,,,Y,,,,Y,,,,,,,,,,,,,,
74761792996,Wikimedia Australia Inc,VIC,3125,Small,,,,Y,Y,,,,,,,,,,,,,,,,,,,,,Y,,,,,,,,,,,,,,
74775152494,Donald Learning Group Inc,VIC,3480,Small,Y,,,,Y,,,,,Y,,,Y,,,Y,Y,Y,,Y,Y,Y,Y,Y,Y,Y,Y,,,,Y,Y,Y,,Y,Y,Y,Y,Y,Y
74786850374,The Congregation Of The Sisters Of The Resurrection Inc,VIC,3040,Small,Y,,,,,,,,,,,Y,,,,,Y,,Y,,,Y,Y,,,,,,,,,,,,,,,,,
74787014200,Mallacoota And District Historical Society_Inc.,VIC,3892,Small,Y,,,Y,,,,,,,,,,,,Y,Y,,,,Y,Y,,,,Y,,,,,,,,,Y,,,,Y,Y
74796045839,All Saints Catholic Church Fitzroy,VIC,3065,Small,Y,,,,,,,,,,,Y,,,,,,,,,,,,,,Y,,,,,,,,,,,,,,
74855337148,Paulino Loro Foundation Inc,VIC,3975,,Y,,,,,,,,,,,,Y,,,,,,,,,,,,,Y,,,,,,,,,,,,,,
74855470037,The Trustee For Thomas Baker Estate,VIC,3001,Small,Y,,,,,,,,,Y,,,,,,,,,,,,,,,,,,,,Y,,,,,,,,,,
74882723939,St Michaels Catholic Church Ashburton,VIC,3147,Small,Y,,,,,,,,,,,Y,,,,,,,,,,,,,,Y,,,,,,,,,,,,,,
74883174802,Uca - Woomelang Uniting Parish,VIC,3485,Small,Y,,,,,,,,,,,Y,,,,,,,,,,,,,,Y,,,,,,,,,,,,,,
74956781327,St Jude's School Scoresby,VIC,3179,Large,Y,,,,Y,,,,,,,Y,,,,,,Y,,,,,,,,,,,,,,,Y,,,,,,,
74989319394,Hospice Lakes Entrance Inc,VIC,3909,Small,Y,,,,,,,,,Y,,,,,,,,,,,,,,,,Y,,,,,,,,,,,,,,
75004997424,Soundhouse Music Alliance Pty Ltd,VIC,3166,Small,Y,,,Y,,,,,,,,,,,,,,Y,,,,,,,,,,,,,,,Y,,,,,,,Y
75005031336,Gippsland Grammar,VIC,3850,Large,Y,,,,Y,,,,,,,,,,,,,Y,,,,,,,,,,,,,,,,,,,,,,Y
75011408833,Global Vaddo Charitable Trust,VIC,3756,Small,,,,Y,,Y,,,,,,,,,,,,,Y,Y,,Y,,Y,,,,,,,,,,,Y,,,,,
75017337844,Council For The Humanities Arts And Social Sciences,VIC,3000,Small,,,,,,,,,,,,,,,,Y,Y,Y,,,,,,,,,,,,,,,,,,,,,,Y
75083196973,Chetwynd Landcare Group,VIC,3318,Small,,,,,,,,,,,,,,,,,,,,,,,,,,,,,,,,,,,,,,,,
75108932574,GPTA Ltd,VIC,3550,Medium,Y,,,,,,,,,,,,,,Y,,,,,,,Y,,,,Y,,,,,,,,,Y,,,,,
75112324384,Community Housing (Vic) Ltd,VIC,3128,Large,Y,Y,,,,,,,,,,,,,,,,,,,,,,,,Y,,,,,,,,,,,,,,
75127736012,Winchelsea St Thomas Bambra,VIC,3000,Small,Y,,,,,,,,,,,Y,,,,,,,,,,,,,,Y,,,,,,,,,,,,,,
75138232337,St Carthages Catholic Church Parkville,VIC,3052,Medium,Y,,,,,,,,,,,Y,,,,,,,,,,,,,,Y,,,,,,,,,,,,,,
75149124774,BirdLife Australia,VIC,3053,Large,Y,,,,,,,Y,,,,,,,,,,,,,,,,,,Y,,,,,,,,,,,,,,
75153094087,The Trustee For The Gordon Darling Foundation,VIC,3004,Medium,Y,,,,,,,,,,,,,,,,,,,,,,,,,,,,Y,Y,,,,,,,,,,
75167631665,Victoria Myanmar Muslim Community Incorporated,VIC,3171,,Y,,,Y,,,,,,,,Y,Y,,,,,,,,Y,,,,,,,Y,,,,,,,,,,,,
75215221903,Heathmont Inter Church Help Inc,VIC,3135,Small,Y,Y,,,,,,,,,,,,,,,,,,,,,,Y,,Y,,,,,Y,,,,,Y,,,,
75254860371,St Colmans Primary School Mortlake,VIC,3272,Large,Y,,,,Y,,,,,,,Y,,,Y,,,Y,,,,,,,,,,,,,,,Y,,,,,,,Y
75260386455,Climate And Health Alliance,VIC,3000,Medium,,,,,,Y,Y,Y,,,,,,,,,,,,,,,,,,Y,,,,,,,,,,,,,,
75268186615,Family Care Sisters Grey Sisters Inc,VIC,3136,Medium,Y,,,,,,,,,,,Y,,,,,,,,,,,Y,,,,,,Y,,,,,,,,,,,
75280230796,Sandridge Lifesaving Club Inc,VIC,3207,Small,Y,Y,,,,,,,,,,,,,,Y,Y,Y,,Y,,Y,Y,,,,Y,,,,,,,,,,,,,Y
75289253306,UCA - IVANHOE UNITING CHURCH AS THE OPERATOR OF A PBI ,VIC,3152,,,Y,,,,,,,,,,,,,,,,,,,,,,,,Y,,,,,,,,,,,,,,
75311698448,Good Shepherd Catholic Church,VIC,3043,Small,Y,,,,,,,,,,,Y,,,,,,,,,,,,,,Y,,,,,,,,,,,,,,
75312802117,St Raphaels Catholic Church West Preston,VIC,3072,Small,Y,,,,,,,,,,,Y,,,,,,,,,,,,,,Y,,,,,,,,,,,,,,
75330451013,The Trustee For Shrine Of Remembrance Foundation Trust,VIC,3141,Large,Y,,,,,,,,,,,,,,,,,,,,,,,,,Y,,,,,,,,,,,,,,
75365008615,Dunolly Preschool Inc,VIC,3472,Small,Y,,,,Y,,,,,,,,,,,,,,,Y,,,,,,,,,,,,,,,,,,,,
75375400348,St Gerards Catholic Church North Dandenong,VIC,3175,Medium,Y,,,,,,,,,,,Y,,,,,,,,,,,,,,Y,,,,,,,,,,,,,,
75375835982,Peninsula Mindfulness Association Incorporated,VIC,3931,Small,Y,,,,Y,Y,,,,,,,,,,,,Y,,,,,,,,,,,,,,,,,,,,,,Y
75395603584,Sandringham & District Historical Society Inc,VIC,3191,Small,Y,,,,,,,,,,,,,,,,,,,,,,,,,Y,,,,,,,,,,,,,,
75412020626,St James College,VIC,3165,Large,Y,,,,Y,,,,,,,Y,,,,,,Y,,,,,,,,,,,,,,,Y,,,,,,,Y
75428827548,The Trustee For Schultz Laubman Schultz Endowment Fund Trust,VIC,3053,,Y,,,,,Y,,,,,,,,,Y,,Y,Y,,,,,Y,,,Y,Y,,,,,,Y,,,,,,,
75461832624,Kardinia International College Future Fund,VIC,3215,Small,Y,,,,,,,,,Y,,,,,Y,,,Y,,Y,Y,,,Y,,,,,,,,,,,,,,,,
75472914876,Uca - Warracknabeal,VIC,3393,Small,Y,,,,,,,,,,,Y,,,,,,,,,,,,,,Y,,,,,,,,,,,,,,
75494636382,Centre for Projection Art Inc.,VIC,3066,Small,Y,,,Y,,,,,,,,,,,Y,Y,,Y,,,Y,Y,Y,Y,Y,Y,,Y,Y,,,,Y,,,,,,,Y
75515602681,Broadford Sub-Branch,VIC,3658,Small,Y,,,,,,,,,Y,,,,,,,,,,,,,,,,,,,,,,,,,,,Y,,,
75604497308,Liberty Common Equity Rental Housing Cooperative Ltd,VIC,3068,Small,Y,,,,,,,,,,,,,,,,,,,,,,,,,Y,,,,,,,,,,,,,,
75605377599,Global Reconciliation (Australia) Limited,VIC,3143,Small,Y,Y,,,,,,,,,,,Y,,,,,,Y,,Y,,,,,Y,,Y,,,,,,,,,,Y,,
75606515137,Living Recovery Ltd,VIC,3142,Small,,Y,,,,Y,,,,,,,,,,,,,,,,,,,,,,,,,,,,,,,,,,
75607670208,YOGAHOOD AUSTRALIA LTD.,VIC,3102,Small,Y,,,,,Y,,,,,,,Y,,,Y,,,,,Y,,Y,,,Y,Y,Y,,,Y,,,,,Y,,,,Y
75610985359,St Clare's Primary School,VIC,3809,Large,Y,,,,Y,,,,,,,Y,,,,,,Y,,Y,,,,,,,,,,,,,,,,,,,,
75618071855,Australian Cycling Promotion Foundation,VIC,0,Medium,,,,,,,Y,,,,,,,Y,,,,Y,,,,,,,,,,,,,,,,,,,,,,
75621970321,The Pip.ilepsy Foundation Limited,VIC,3097,,Y,,,,,Y,,,,,,,Y,,,,,,,,,,,,,Y,,,,Y,,Y,,,,,,,,
75659039490,Barwon Community Legal Service Inc,VIC,3216,Large,Y,Y,,,,,,,Y,,,,Y,,,Y,Y,,,,Y,Y,,Y,,,,,,,Y,,,,,,,,,
75697016939,Melbourne Intervarsity Choral Festival Incorporated,VIC,3055,Small,,,,Y,,,,,,,,,,,,Y,Y,,,,,,,,,,,,,,,,,,,,,,,Y
75698494045,Mallacoota District Health & Support Service Inc,VIC,3892,Large,Y,Y,,,,Y,,,,,,,,,,,,,,,,,,,,Y,,,,,,,,,,,,,,
75759193814,THE SILENT WITNESS NETWORK INCORPORATED,VIC,3032,Small,Y,,,,Y,,,,Y,,,,Y,,,Y,Y,Y,,,Y,Y,Y,Y,Y,Y,Y,,Y,,Y,,Y,Y,Y,Y,,Y,,Y
75766835386,STAWELL RSL SUB-BRANCH PATRIOTIC FUND,VIC,3000,Small,Y,,,,,Y,,,,,,,Y,Y,,,,,,,,,,,,,,,,,,,,,,,Y,,,
75769301793,Bendigo Diocesan Trusts Corporation ,VIC,3552,Small,Y,,,,,,,,,,,Y,,,,,,,,,,,,,,Y,,,,,,,,,,,,,,
75778301978,International Safety Foundation,VIC,3132,Small,Y,,,,,,,,,Y,,,,,,,,,,,,,,,,,,,,,,,Y,,,,,,,Y
75812792400,Cornerstone Contact Centre Inc,VIC,3175,Small,Y,,,,,,,,,,,,,,,Y,Y,,,,,,,Y,,,,,,,Y,,,,,,,,,
75981980793,JOCARE-CARING FOR NEIGHBOURS INCORPORATED,VIC,3144,,Y,Y,,,,,,,,,,,Y,,,,Y,,,,,,,,,,,,,,,,,,,,,,,
75984076512,The Christian Science Association Of The Pupils Of Mrs Beverley Beddoes-Mills Csb,VIC,3744,Small,Y,,,,,,,,,,,Y,,,,Y,Y,Y,,Y,,Y,,,,Y,,,,,,,,,,,,,,Y
76015082549,Auspicious Projects Inc,VIC,3066,Small,Y,,,,,,,,,,,,,,,,,,,,,,,,,Y,,,,,,,,,,,,,,
76047241067,Friends Of Grammar Inc - Swap Shop,VIC,3004,Small,Y,,,,Y,,,,,,,,,,,,,Y,,,,,,,,,,,,,,,,,,,,,,Y
76049755453,St Marys Primary School Whittlesea,VIC,3757,Large,Y,,,,Y,,,,,,,Y,,,,,,Y,,,,,,,,,,,,,,,Y,,,,,,,
76070613455,The Jewish Children's Support Centre,VIC,3183,Small,Y,Y,,,,,,,,Y,,,Y,,,Y,Y,Y,,,Y,Y,,Y,,Y,,,,,,,,,,Y,,,,Y
76072705598,Karingal Neighbourhood House Inc,VIC,3199,Medium,Y,,,,,,,,,,,,,,,Y,Y,Y,,Y,Y,Y,Y,,,,Y,,,Y,,,Y,,,Y,,,,Y
76087992998,Christian College Institute of Senior Education Ltd,VIC,3216,Large,Y,,,,Y,,,,,,,Y,,,,,,Y,,,,Y,,,,,,,,,,,,,,,,,,Y
76104671589,Melbourne Art Foundation Ltd,VIC,3121,Medium,Y,,,Y,,,,,,,,,,,,,,,,,,,,,,Y,,,,,,,,,,,,,,
76143155160,Anglesea Music Festival Inc,VIC,3230,Small,,,,,,,,,,,,,,,,,,,,,,,,,,,,,,,,,,,,,,,,
76153844767,UCA - SOPHIA'S SPRING,VIC,3057,Small,Y,,,,,,,,,,,Y,,,,,,,,,,,,,,Y,,,,,,,,,,,,,,
76338261728,St Johns Anglican Church Bentleigh,VIC,3204,Small,Y,,,,,,,,,,,Y,,,,,,,,,,,,,,Y,,,,,,,,,,,,,,
76355638426,St Monicas School,VIC,3011,Large,Y,,,,Y,,,,,,,Y,,,,,,Y,,,,,,,,,,,,,,,Y,,,,,,,
76370408317,St Clare's Primary School Thomastown,VIC,3074,Large,Y,,,,Y,,,,,,,Y,,,,,,Y,,,,,,,,,,,,,,,Y,,,,,,,
76421028851,Doxa School Bendigo,VIC,3550,Large,Y,,,,Y,,,,,,,Y,,,,,,Y,,,,,,,,,,,,,,,,,,,,,,Y
76464009935,The Trustee For Alan George Barker Estatefaculty Of Music Uom J M Scholarship,VIC,3001,Small,Y,,,,,,,,,Y,,,,,,,,,,,,,,,,,,,,Y,,,,,,,,,,
76474275044,Our Lady Of Protection Ukrainian Catholic Church Geelong,VIC,3215,Small,Y,,,,,,,,,,,Y,,,,,,,,,,Y,,,,,,,,,,,,,,,,,,
76494167521,Rsl Loch Sport Sub Branch Inc,VIC,3851,Medium,Y,,,,,,,,,Y,,,,,,,,,,,,,,,,,,,,,,,,,,,Y,,,
76516174696,TEMPLESTOWE RSL SUB-BRANCH BUILDING PATRIOTIC FUND NO 2669,VIC,3106,Small,Y,,,,,,,,,,,,,,,,,,,,,,,,,,,,,,,,,,,,Y,,,
76566223684,U3A Yarra Ranges Incorporated,VIC,3137,Small,Y,,,Y,,Y,,,,Y,,,Y,Y,,,,,,,,,,,,Y,,,Y,,,,,,,,,,,
76570654514,Mungabareena Aboriginal Corporation,VIC,3690,,,Y,,,,,,,,,,,,,Y,,,,,,,,,,,,,,,,,,,,,,,,,
76593147884,The Trustee For The Estate Of Harold Edward Hurst,VIC,3215,Small,Y,,,,,,,,,,,,,,,,,,,,,,,,,Y,,,,,,,,,,,,,,Y
76607649930,St Joseph's Roman Catholic Church Wonthaggi,VIC,3995,Small,Y,,,,,,,,,,,Y,,,,,,,,,,,,,,Y,,,,,,,,,,,,,,
76611210102,St Patrick's School,VIC,3418,Large,Y,,,,Y,,,,,,,Y,,,Y,,,Y,,,,,,,,,,,,,,,Y,,,,,,,Y
76694009009,Uca - Natimuk Goroke Parish,VIC,3409,Small,Y,,,,,,,,,,,Y,,,,,,,,,,,,,,Y,,,,,,,,,,,,,,
76700822577,The Trustee For Campbellfield Lands Trust,VIC,3000,Small,Y,,,,,,,,,,,Y,,,,,,,,,,,,,,Y,,,,,,,,,,,,,,
76745874254,St Patricks Primary School Pyramid Hill,VIC,3575,Medium,Y,,,,Y,,,,,,,Y,,,,,,Y,,,,,,,,,,,,,,,,,,,,,,
76750969979,South West Institute Of Technical And Further Education,VIC,3280,Large,Y,,,,Y,,,,,,,,,,,,,,,,,,Y,Y,,Y,Y,,,,,,,,Y,Y,,,,
76776582693,Swan Hill Rsl Sub-Branch Inc,VIC,3585,Large,Y,,,,,Y,,,,Y,,,Y,Y,,,,,,,,,,,,,,,,,,,,,Y,,Y,,,
76800804328,Mother Teresa Catholic Primary school,VIC,3064,Large,Y,,,,Y,,,,,,,Y,,,,,,Y,,,,,,,,,,,,,,,Y,,,,,,,
76908788431,Belmore Rd Church Of Christ Inc,VIC,3129,Small,Y,,,,,,,,,,,Y,,,,Y,Y,Y,Y,Y,,Y,,,,Y,,,,,,,,,,,,,,Y
76914017715,Adass Israel Kinder Club,VIC,3183,Small,Y,,,Y,,,,,,,,,,,,,,,,Y,,,,,,,,,,,,,,,,,,,,
76943233260,Hume Mens Shed (Craigieburn) Inc.,VIC,3064,Small,Y,,,,,Y,,,,Y,,,Y,,Y,Y,Y,,,,Y,,,Y,Y,,Y,Y,,,Y,Y,Y,,,Y,Y,,,
76960855382,Uca-Douglas Church Committee Board,VIC,3409,Small,Y,,,,,,,,,,,Y,,,,,,,,,,,,,,Y,,,,,,,,,,,,,,
76973256676,Cloverdale Care Inc,VIC,3219,Small,Y,,,,,,,,,Y,,,,,,Y,,Y,,,Y,Y,,,,,,Y,,,Y,,,,,Y,,,,Y
76980730066,Jacksons Creek Common Equity Rental Housing Co Operative Ltd,VIC,3429,Small,Y,,,,,,,,,Y,,,,,,,,,,,,,,,,Y,,,,,,,,,,,,,,
77073120485,St Anne's School-Kew East,VIC,3102,Large,Y,,,,Y,,,,,,,Y,,,,,,Y,,,,,,,,,,,,,,,Y,,,,,,,
77097135754,Independence Solutions,VIC,3012,Small,Y,Y,,,,,,,,,,,,,,,,,,,,,,,,Y,,,,,,,,,,,,,,
77113740446,The John Bosco Odongo Health Foundation,VIC,3400,Small,Y,,,,,Y,,,,,,,,,,,,,Y,,,Y,Y,,,,Y,,,,,,,,,,,,,
77131997830,St Thomas More School,VIC,3350,Large,Y,,,,Y,,,,,,,Y,,,Y,,,Y,,,,,,,,,,,,,,,Y,,,,,,,Y
77138845408,Bayview Community Church,VIC,3939,Medium,Y,,,,,,,,,,,Y,,,,,,,,,,Y,,Y,,Y,,,,Y,,,,,,,,,,Y
77139532439,The Westbourne Scholarship Fund,VIC,3029,,Y,,,,Y,,,,,,,,,,,,,,,,,,,,,Y,,,,,,,,,,,,,,
77196184865,Munatunga Elders Aboriginal Corporation,VIC,3549,,Y,,,,,,,,,,,,,,Y,,,,,,,,,,,,,,,,,,,,,,,,,
77203364629,SEA LAKE RSL SUB-BRANCH PATRIOTIC FUND,VIC,3000,Small,Y,,,,,,,,,,,,,,,,,,,,,,,,,,,,,,,,,,,,Y,,,
77239051987,ROKEWOOD RSL SUB-BRANCH PATRIOTIC FUND,VIC,3000,Small,Y,,,,,,,,,,,,,,,,,,,,,,,,,,,,,,,,,,,,Y,,,
77239304724,St Monica's Primary School,VIC,3690,Large,Y,,,,Y,,,,,,,Y,,,,,,Y,,,,,,,,,,,,,,,,,,,,,,
77311510165,Our Lady Of The Nativity Primary School Essendon West,VIC,3040,Large,Y,,,,Y,,,,,,,Y,,,,,,Y,,,,,,,,,,,,,,,Y,,,,,,,
77326477809,St Ignatius Catholic Church Richmond,VIC,3121,Medium,Y,,,,,,,,,,,Y,,,,,,,,,,,,,,Y,,,,,,,,,,,,,,
77438801287,Deans Marsh Community Cottage Inc,VIC,3235,Small,Y,,,,,,,,,Y,,,,,,Y,Y,Y,,,,Y,,,,Y,,,,,,,,,Y,,,,,
77457276426,South Castlemaine Kindergarten Inc,VIC,3450,Small,Y,,,,Y,,,,,,,,,,,,,,,Y,,,,,,,,,,,,,,,,,,,,
77523170379,St Christopher's Catholic Church Syndal,VIC,3150,Medium,Y,,,,,,,,,,,Y,,,,,,,,,,,,,,Y,,,,,,,,,,,,,,
77525058095,The Trustee For Winifred May Lees Memorial Fund,VIC,3000,Small,Y,,,,,,,,,,,Y,,,,,,,,,,,,,,Y,,,,,,,,,,,,,,
77557417261,St Joseph's Primary School Benalla,VIC,3672,Large,Y,,,,Y,,,,,,,,,,,,,Y,,,,,,,,,,,,,,,,,,,,,,
77602606075,Wound Healing Institute Australia Ltd,VIC,3000,Small,Y,,,,Y,Y,,,,,,,,,Y,,Y,,,,,,,,,Y,,,,,,Y,,,Y,,,,,
77630328773,ARROW LEADERSHIP - INTERNATIONAL DEVELOPMENT LIMITED,VIC,3134,,Y,,,,,,,,,,,Y,,,,,,,Y,,,,,,,,,,,,,,,,,,,,,
77681078648,GEELONG RSL SUB-BRANCH PATRIOTIC FUND,VIC,3000,Medium,Y,,,,,Y,,,,,,,Y,Y,,,,,,,,,,,,,,,,,,,,,,,Y,,,
77682492644,Trustee for Upotipotpon Foundation,VIC,3121,Medium,Y,,,,,,,,,Y,,,,,,,,,,,,,,,,Y,,,,,,,,,,,,,,
77812545768,ANGLESEA RSL SUB-BRANCH PATRIOTIC FUND,VIC,3000,Small,Y,,,,,Y,,,,,,,Y,Y,,,,,,,,,,,,,,,,,,,,,,,Y,,,
77824435980,The Trustee For The Rosemary Norman Foundation,VIC,3186,Small,Y,,,,Y,,,,,,,,,,,,Y,,,,,,,,,Y,,,,,,Y,,,,,,,,
77829359862,St Joseph's Catholic School,VIC,3396,Large,Y,,,,Y,,,,,,,Y,,,Y,,,Y,,,,,,,,,,,,,,,Y,,,,,,,Y
77895701746,Saint Mary Magdalens Catholic Church Trentham,VIC,3444,Small,Y,,,,,,,,,,,Y,,,,,,,,,,,,,,Y,,,,,,,,,,,,,,
77914476179,St Marys School Echuca,VIC,3564,Large,Y,,,,Y,,,,,,,Y,,,,,,Y,,,,,,,,,,,,,,,,,,,,,,
77955207127,Uca - Myrtleford/Whorouly Parish,VIC,3737,Small,Y,,,,,,,,,,,Y,,,,,,,,,,,,,,Y,,,,,,,,,,,,,,
77956449299,The Orchestra and Drama Halls Trust,VIC,3280,,Y,,,Y,,,,,,,,,,,,,,,,,,,,,,Y,,,,,,,,,,,,,,
78007306283,Australian National Memorial Theatre Limited,VIC,3182,Large,Y,,,Y,,,,,,,,,,,,,,Y,,,,Y,,,,,,,,Y,,,,,,,,,,Y
78046165650,Christ The King School Building Fund,VIC,3219,Small,Y,,,,Y,,,,,,,,,,,,,Y,,,,,,,,,,,,,,,,,,,,,,
78076752843,Divya Jyoti Jagrati Sansthan Inc,VIC,3029,Small,Y,,,,,,,,,,,,,,,,,,Y,,,,,,,Y,,,,,,,,,,,,,,
78119557719,St Christopher's School Airport West,VIC,3042,Large,Y,,,,Y,,,,,,,Y,,,,,,Y,,,,,,,,,,,,,,,Y,,,,,,,
78124451540,Meaningful Ageing Australia Ltd,VIC,3050,Medium,,,,,Y,Y,,,,Y,,,Y,,,,Y,,,,,,,,,,,,,,,,,,,,,,,
78125531707,UMSU Incorporated,VIC,3010,Large,Y,,,,Y,,,,,,,,,,,,,,,,,,,,,Y,,,,,,,,,,,,,,
78223654826,Ward Avenue Kindergarten Inc.,VIC,3167,Small,Y,,,,Y,,,,,,,,,,,,,,,Y,,,,,,,,,,,,,,,,,,,,
78254078874,GREEK ORTHODOX ARCHDIOCESE OF AUSTRALIA CONSOLIDATED TRUST PARISH OF ST RAPHAEL EAST BENTLEIGH LADIES AUXILIARY,VIC,3204,Small,Y,,,,,,,,,,,,,,,,,,,,,,,,,Y,,,,,,,,,,,,,,
78256259972,St Clare's Catholic Primary School,VIC,3029,Large,Y,,,,Y,,,,,,,Y,,,,,,Y,,,,,,,,,,,,,,,Y,,,,,,,
78268060738,Thorpdale & District Kindergarten Inc.,VIC,3835,Small,Y,,,,Y,,,,,,,,,,,,,,,Y,,,,,,,,,,,,,,,,,,,,
78274788328,Heart Focus Community Care,VIC,3844,Small,Y,Y,,,,,,,,,,,Y,,,Y,Y,Y,,Y,,Y,Y,Y,,,Y,,,,Y,Y,Y,,Y,Y,Y,Y,Y,Y
78280590434,Uca - Horfield Uniting Church,VIC,3567,Small,Y,,,,,,,,,,,Y,,,,,,,,,,,Y,,,,Y,,,,,,,,,,,,,
78306323432,St Elizabeth's Primary School,VIC,3175,Large,Y,,,,Y,,,,,,,Y,,,,,,Y,,,,,,,,,,,,,,,Y,,,,,,,
78337281588,St Pius X School,VIC,3081,Large,Y,,,,Y,,,,,,,Y,,,,,,Y,,,,,,,,,,,,,,,Y,,,,,,,
78341606751,Victorian Medical Benevolent Association Incorporated,VIC,3081,Medium,Y,,,,,,,,,Y,,,,,,Y,Y,,,,,Y,Y,,,,Y,,,,,,,,Y,Y,,,,
78363674607,Estate M G Malloy - Bill & Mena Malloy Trust,VIC,3001,Small,Y,,,,,,,,,Y,,,,,,,,,,,,,,,,,,,,Y,,,,,,,,,,
78370233820,St Francis Xavier's Catholic Primary School,VIC,3214,Large,Y,,,,Y,,,,,,,Y,,,,,,Y,,,,,,,,,,,,,,,Y,,,,,,,
78396127031,St Macartans Catholic Church Mornington,VIC,3931,Medium,Y,,,,,,,,,,,Y,,,,,,,,,,,,,,Y,,,,,,,,,,,,,,
78446978431,The Greek Orthodox Community Of Oakleigh & District Inc,VIC,3166,Large,Y,,,,,,,,,,,,,,,,Y,Y,,,Y,,Y,,,,Y,Y,,,,,,,,,,,,Y
78482029172,Romsey-Lancefield RSL Sub-Branch Patriotic Fund,VIC,3000,Small,Y,,,,,Y,,,,,,,Y,Y,,,,,,,,,,,,,,,,,,,,,,,Y,,,
78482689937,St Peter The Apostle Catholic Church East Keilor,VIC,3033,Small,Y,,,,,,,,,,,Y,,,,,,,,,,,,,,Y,,,,,,,,,,,,,,
78497105065,Loreto Toorak Past Pupils' Association Incorporated,VIC,3142,Small,Y,,,,Y,,,,,,,Y,Y,,,,,Y,Y,,,,Y,Y,,,,,,Y,,,,,,,,,,Y
78513040891,Swifts Creek Bush Nursing Centre Inc.,VIC,3896,Medium,Y,,,,,Y,,,,,,,,,,Y,Y,Y,,Y,,Y,Y,,,,Y,,,,,Y,,,,,,,Y,Y
78530810682,Abundant Grace Bible Church,VIC,3131,Small,Y,,,,,,,,,,,Y,,,,,,,,,,,,,,Y,,,,,,,,,,,,,,
78558809380,Dann/Rayner Fund For Theological Education,VIC,3000,Small,Y,,,,,,,,,,,Y,,,,,,,,,,,,,,Y,,,,,,,,,,,,,,
78570885286,St John Vianney's Catholic Church Mulgrave,VIC,3170,Medium,Y,,,,,,,,,,,Y,,,,,,,,,,,,,,Y,,,,,,,,,,,,,,
78577549329,Disability Resources Centre Inc,VIC,3000,Medium,Y,Y,,,,,,,Y,,,,Y,,,Y,Y,,,,,,,,,Y,,,,,,Y,Y,,Y,,,,,Y
78581846304,Greek Orthodox Archdiocese Of Aust Holy Monastery Of Panagia Gorgoepikoos,VIC,3221,Medium,Y,,,,,,,,,,,,,,,,,,,,,,,,,Y,,,,,,,,,,,,,,
78605780966,The Church At Archies Creek Inc,VIC,3995,Small,Y,,,,,,,,,,,Y,,,,,,,,,,,,,,Y,,,,,,,,,,,,,,
78630001446,Moreland Affordable Housing Ltd,VIC,3058,,Y,,,,,,,,,,,,Y,,,,,,,,,,,Y,,,,,,,Y,,,,,,,,,
78646379036,The Trustee For Leslie Talbot Batten Estate,VIC,3000,Small,Y,,,,,Y,,,,,,,,,,,,,,,,,,,,Y,,,,,,,,,,,,,,
78688401188,BRIGHT RSL SUB-BRANCH PATRIOTIC FUND,VIC,3000,Small,Y,,,,,Y,,,,,,,Y,Y,,,,,,,,,,,,,,,,,,,,,,,Y,,,
78690908138,Doncaster RSL Sub-Branch Patriotic Fund,VIC,3000,Small,Y,,,,,Y,,,,,,,Y,Y,,,,,,,,,,,,,,,,,,,,,,,Y,,,
78693629425,Emmaus College,VIC,3133,Large,Y,,,,Y,,,,,,,Y,,,,,,Y,,,,,,,,,,,,,,,Y,,,,,,,Y
78697997447,Walhalla Heritage And Development League,VIC,3825,Small,Y,,,,,,,,,Y,,,,,,,,,,,,Y,,,,Y,,,,,,,,,,,,,,
78701591822,Church For The Whole Family Dandenong South Inc,VIC,3177,Small,Y,,,,,,,,,,,Y,,,Y,Y,Y,Y,,,Y,,Y,,,Y,Y,Y,,,Y,Y,Y,Y,,Y,,Y,Y,Y
78731286017,Taraleigh Steiner Kindergarten and Playgroup,VIC,3165,Medium,Y,,,,Y,,,,,,,,,,,,,,,Y,,Y,,,,,,,Y,,,,,,,,,,,
78750731039,KEILOR EAST RSL SUB-BRANCH PATRIOTIC FUND,VIC,3000,Small,Y,,,,,Y,,,,,,,Y,Y,,,,,,,,,,,,,,,,,,,,,,,Y,,,
78758431132,INVERLOCH RSL SUB-BRANCH PATRIOTIC FUND,VIC,3000,Small,Y,,,,,Y,,,,,,,Y,Y,,,,,,,,,,,,,,,,,,,,,,,Y,,,
78766448344,Catani Community Church,VIC,3981,Small,Y,,,,,,,,,,,Y,,,,,,,,,,,,,,Y,,,,,,,,,,,,,,
78836957753,Holy Rosary School Heathcote,VIC,3523,Large,Y,,,,Y,,,,,,,Y,,,,,,Y,,,,,,,,,,,,,,,,,,,,,,
78926246721,Bubup Wilam Aboriginal Child and Family Centre Incorporated,VIC,3074,Large,Y,Y,,,,,,,,,,,Y,,Y,,,,,Y,,Y,,,,,,,,,,,,,,,,,,
79004166349,Camberwell Anglican Girls' Grammar School,VIC,3126,Large,Y,,,,Y,,,,,,,,,,,,,Y,,Y,,,Y,,,,,,,,,,,,,,,,,Y
79004295523,Natural Resources Conservation League Of Victoria,VIC,3103,Large,Y,,,,,,,Y,,,,,,,,,,,,,,,,,,Y,,,,,,,,,,,,,,
79009931881,Uca - Parish Of Pakenham District,VIC,3810,Small,Y,,,,,,,,,,,Y,,,,,,,,,,,,,,Y,,,,,,,,,,,,,,
79093296719,Spotswood Kingsville RSL Sub Branch,VIC,3015,Small,Y,,,,,,,,,,,,,Y,,,,,,,,,,,,Y,,,,,,,,,,,Y,,,
