35066324721,SICG Pty Ltd,VIC,3222,Small,Y,,,,Y,,,,,,,,,,,,,Y,,,,,,Y,,,,,,,,,Y,,,,,,,Y
35079462570,Faith Christian Fellowship Ltd,VIC,3754,Small,Y,,,,,,,,,Y,,,,,,,,,,,,,,,,,,,,Y,,,,,,,,,,
35079824203,Warrnambool College Foundation Limited,VIC,3280,Small,Y,,,,,,,,,,,,,,,,,Y,,,,,,,,,,,,,,,,,,,,,,Y
35115082212,Australian Camps Association,VIC,3072,Large,Y,Y,,,,,,,,,,,,,Y,Y,,Y,,,Y,Y,Y,,Y,,Y,Y,,,,,Y,,Y,,,,,Y
35117060232,Swinburne Student Amenities Association Limited,VIC,3122,Large,Y,,,,Y,,,,,,,,,,Y,Y,,,,,,,Y,,,Y,Y,,,,,,Y,,,Y,,,,Y
35133614650,International Apostolic Ministries Worldwide,VIC,3029,Small,,,,,,,,,,,,Y,,,,,,,,,,,,,,,,,,,,,,,,,,,,
35146117211,The Bays Healthcare Group Inc.,VIC,3931,Large,Y,Y,,,,,,,,,,,,,,Y,Y,,,Y,,Y,,,,Y,,,,,,,,,,,,,,
35217156106,St Agatha's Primary School,VIC,3977,Large,Y,,,,Y,,,,,,,Y,,,,,,Y,,Y,,,,,,,,,,,,,,,,,,,,
35232394922,The Trustee For Kingdom Investment Fund,VIC,3152,Large,Y,,,,,,,,,Y,,,,,,,,,,,,,,,,Y,,,,,,,,,,,,,,
35232683412,St James Old Cathedral Anglican Church Melbourne West,VIC,3003,Medium,Y,,,,,,,,,,,Y,,,,,,,,,,,,,,Y,,,,,,,,,,,,,,
35240972336,The Trustee For Jobie Dajka Fund,VIC,3054,Small,,,,,,,,,,,,,,,,,,,,,,,,,,,,,,,,,,,,,,,,
35278026639,Cardinia Environment Coalition Inc,VIC,3810,Medium,Y,,,,,,,,,,,,,,,,,,,,,,,,,Y,,,,,,,,,,,,,,
35419274245,The Trustee For Swim For Life,VIC,3193,Small,,,,,,,,,,,,,,,,,,,,,,,,,,,,,,,,,,,,,,,,
35432137202,Duke Street Community House Association,VIC,3020,Medium,Y,,,,Y,,,,,,,,,,,Y,Y,,,,Y,,Y,,,,Y,Y,,,,,Y,,,Y,,,,
35436568355,St Finbar's Primary School,VIC,3187,Large,Y,,,,Y,,,,,,,Y,,,,,,Y,,,,,,,,,,,,,,,Y,,,,,,,
35441293080,MISSION INDIA FAITH HOPE AND LOVE INC,VIC,3216,Small,,Y,,,,,,,,,,,Y,,,Y,Y,Y,,,,Y,Y,Y,,,Y,,,,Y,,,,,Y,,,,Y
35471389639,Bendigo Diocesan Trusts Corporation,VIC,3552,Small,Y,,,,,,,,,,,Y,,,,,,,,,,,,,,Y,,,,,,,,,,,,,,
35534063578,Arch Of Victory/Avenue Of Honour Committee Incorporated,VIC,3350,Small,Y,,,,,,,,,,,,,,,,,,,,,,,,,Y,,,,,,,,,,,Y,,,
35541268863,Grace Community Church Wangaratta Part of the Presbyterian Reformed Church Australia,VIC,3677,Small,Y,,,,,,,,,,,Y,,,,,,,,,,Y,,,,Y,,,,,,,,,,,,,,
35547026748,Asian Australian Foundation,VIC,3000,Small,Y,,,,,,,,,Y,,,,,,Y,,Y,,,Y,Y,,Y,,Y,,,Y,Y,Y,,,,,,,,,Y
35547605585,Voluntary Outreach Club Incorporated,VIC,3340,Small,Y,,,,,,,,,,,,Y,,,,Y,,Y,,,,,Y,,Y,,Y,,,,,,,,,,,,
35601004068,Autism After Hours Activities Limited,VIC,3936,Small,Y,Y,,,,,,,,,,,Y,,,,,Y,,,,Y,,,,,,,,,,,Y,,,,,,,Y
35645873419,North Central Living Waters Cluster,VIC,3477,Small,,,,,,,,,,,,Y,,,,,,,,,,,,,,,,,,,,,,,,,,,,
35685643782,Box Forest Wesleyan Methodist Church,VIC,3046,Small,Y,,,,,,,,,,,Y,,,,Y,Y,Y,,Y,,Y,,,,,,,,,,,,,,,,,,Y
35721147626,SOUTH WEST CO-OP LTD,VIC,3280,Small,Y,,,,,,,,,Y,,,,,,,,,,,,,,,,Y,,,,,,,,,,,,,,
35799716590,Shakthi Migrant & Refugee Women's Support Group Melbourne Inc.,VIC,3179,Small,Y,,,,,,,,,,,,,,,Y,Y,,,,Y,Y,Y,,,,,Y,,,,,,,,,,Y,,Y
35828116540,Association Of Greek Elderly Citizens Clubs Of Melbourne & Victoria Inc,VIC,3056,Small,Y,,,,Y,Y,,,,,,,,,,Y,Y,,,,Y,,Y,,,,Y,Y,,Y,,Y,,,,,Y,,,
35928521721,Thrive Community Incorporated,VIC,3220,Small,Y,,,,,,,,,Y,,,,,,Y,,,,,,Y,,Y,,,,,,,Y,,,,,,,,,
35939638959,The Trustee For The Global Reconciliation Foundation,VIC,3143,Small,Y,,,,,,,,,,Y,,,,,,,,,,,,,,,Y,,,,,,,,,,,,,,
36022859342,Parish Of Box Hill And Box Hill North,VIC,3128,Medium,Y,,,,,,,,,,,Y,,,,,,,,,,,,,,Y,,,,,,,,,,,,,,
36050385269,Xcite Community Church,VIC,3053,Small,Y,,,,,,,,,,,Y,,,,,,,,,Y,,,,,,,,,,,,,,,,,,,
36057096465,Leadership Victoria Ltd,VIC,3000,Large,Y,,,,,,,,,Y,,,Y,,Y,,,,,,Y,,,,Y,Y,,,,,,,Y,,,,,,,
36075993463,Marysville Public Cemetery,VIC,3779,Small,Y,,,,,,,,,Y,,,,,,,,,,,,,,,,Y,,,Y,,,,,,,,,,,
36081250142,Rainbows For The Children Of Australia,VIC,3195,Small,Y,,,,,,,,,Y,,,Y,,,,,Y,,Y,,,,,,,,,,,,,,,,,,,,Y
36094170975,Southern Cross Kids' Camps,VIC,3796,Medium,Y,Y,,,,,,,,,,,Y,,Y,,,Y,,,,,,,,,,,,Y,,,,,,,,Y,,
36175114394,Bell Grove Common Equity Rental Housing Cooperative Ltd,VIC,3222,Small,Y,,,,,,,,,,,,,,,,,,,,,,,,,Y,,,,,,,,,,,,,,
36239032321,Diamond Valley Community Support Inc,VIC,3088,Medium,Y,Y,,,,,,,,,,,Y,,Y,Y,Y,,,,Y,Y,Y,Y,Y,,Y,Y,,Y,Y,,,,,Y,,Y,,Y
36256164819,St Catherines School,VIC,3806,Large,Y,,,,Y,,,,,,,Y,,,,,,Y,,Y,,,,,,,,,,,,,,,,,,,,
36282548280,St Patricks School,VIC,3140,Large,Y,,,,Y,,,,,,,Y,,,,,,Y,,,,,,,,,,,,,,,Y,,,,,,,
36309034934,APOLLO BAY RSL SUB-BRANCH  PATRIOTIC FUND,VIC,3000,Small,Y,,,,,Y,,,,,,,Y,Y,,,,,,,,,,,,,,,,,,,,,,,Y,,,
36328706972,Melbourne University Health Initiative,VIC,3053,Small,Y,,,,,,,,,,,,,,,,,,Y,,,,,,,Y,,,,,,,,,Y,,,,,Y
36350206511,RYE RSL SUB-BRANCH PATRIOTIC FUND,VIC,3000,Medium,Y,,,,,Y,,,,,,,Y,Y,,,,,,,,,,,,,,,,,,,,,,,Y,,,
36351698110,Experimenta Media Arts Inc,VIC,3066,Medium,Y,,,Y,,,,,,Y,,,,,,,,,,,,,,,,Y,,,,,,,,,,,,,,
36371261046,St Dominics Primary School Broadmeadows,VIC,3047,Large,Y,,,,Y,,,,,,,Y,,,,,,Y,,,,,,,,,,,,,,,Y,,,,,,,
36391805535,Anglican Trusts Corporation Of The Diocese Of Gippsland,VIC,3820,Small,Y,,,,,,,,,,,Y,,,,,,,,,,,,,,Y,,,,,,,,,,,,,,
36392770774,Bungalook Creek Wildlife Shelter Inc.,VIC,3765,Small,Y,,Y,,,,,Y,,Y,,,,,,Y,Y,,,,,Y,,,,Y,,,,Y,,,,,,,,,,
36394849358,Timboon Community Church Incorporated,VIC,3268,Small,Y,,,,,,,,,,,Y,,,,,,,Y,,,,,,,Y,,,,,,,,,,,,,,
36413570569,Church By the Bay,VIC,3223,Medium,Y,,,,,,,,,,,Y,,,,,,,,Y,,Y,,,,,,,,,,,,,,,,,,Y
36460895969,Grace Missions,VIC,3763,Small,Y,,,,,,,,,,,,,,,,,,,,,,,,,Y,,,,,,,,,,,,,,
36473527358,THE RETURNED SERVICES LEAGUE OF AUSTRALIA VICTORIAN BRANCH - HAMILTON WELFARE PATRIOTIC FUND,VIC,3000,Small,Y,,,,,,,,,,,,,,,,,,,,,,,,,,,,,,,,,,,,Y,,,
36496446654,Friends Of Grammar Inc - Executive,VIC,3004,Small,Y,,,,Y,,,,,,,,,,,,,Y,,,,,,,,,,,,,,,,,,,,,,Y
36508476509,THE TRUSTEE FOR THE UNIVERSAL PEACE MOVEMENT CHARITY TRUST,VIC,3058,Small,,,,,,,,,,,,,,,,,,,,,,,,,,,,,,,,,,,,,,,,
36621981453,MRC Foundation,VIC,3145,Medium,Y,,,,,,,,,Y,,,,,,,,,,,,,Y,Y,,,Y,,Y,Y,Y,Y,Y,,,Y,,,,
36630264103,CHURCHES OF CHRIST COMMUNITY CHILDCARE FOR MISSION LIMITED,VIC,3078,Small,Y,,,,,,,,,,,Y,Y,,,,,,,Y,,,,,,,,,,,,,,,,,,,,
36631403562,St Michaels Mt Dandenong - Johnson,VIC,3000,Small,Y,,,,,,,,,,,Y,,,,,,,,,,,,,,Y,,,,,,,,,,,,,,
36698901499,Anglican Trusts Corporation Of The Diocese Of Gippsland,VIC,3950,Small,Y,,,,,,,,,,,Y,,,,,,,,,,,,,,Y,,,,,,,,,,,,,,
36789561975,The Trustee For Melbourne Education Trust,VIC,3091,Large,Y,,,,Y,,,,,,,,,,,,,,,,,,Y,,,Y,Y,,,,,Y,Y,,,Y,,,,
36790209057,Ti Tree Common Equity Rental Housing Co-Operative Ltd,VIC,3199,Small,Y,,,,,,,,,Y,,,,,,,,,,,,,,,,Y,,,,,,,,,,,,,,
36964730577,Friends Of Grammar Inc- Senior School,VIC,3004,Small,Y,,,,Y,,,,,,,,,,,,,Y,,,,,,,,,,,,,,,,,,,,,,Y
36973885430,Pride In Care Incorporated,VIC,3073,Small,,,,,Y,,,,,,,,,,,,,,,,,,,,,,,,,,,,,,,,,,,
36979408997,GEMBOOK RSL SUB-BRANCH PATRIOTIC FUND,VIC,3000,Small,Y,,,,,Y,,,,,,,Y,Y,,,,,,,,,,,,,,,,,,,,,,,Y,,,
36981897172,Rosewall Neighbourhood Centre Inc.,VIC,3214,Medium,Y,,,,,,,,,Y,Y,,Y,,Y,Y,,,,,,Y,Y,Y,,Y,,Y,,,,,Y,,Y,Y,,,,
36990772736,St Thomas More Primary School,VIC,3930,Large,Y,,,,Y,,,,,,,Y,,,,,,Y,,,,,,,,,,,,,,,Y,,,,,,,
36995412870,St Fidelis Catholic Church Moreland,VIC,3058,Small,Y,,,,,,,,,,,Y,,,,,,,,,,,,,,Y,,,,,,,,,,,,,,
36996814424,Cultural Connections Connecting to Country Incorporated,VIC,3875,,Y,,,Y,,Y,,,,,,,,,Y,,,,,,,,,,,,,,,,,Y,,,Y,,,,,
37008464426,The Australian Kidney Foundation,VIC,3205,Large,Y,Y,,,,,,,,,,,,,,,,Y,,,,,,,,Y,,,,,,Y,,,Y,,,,,Y
37039779253,Victorian Squadron Air Training Corps,VIC,3030,Small,Y,,,,,,,,,,,,,,,,,,,,,,Y,,,Y,Y,,,,,,,,,,,,,
37120589130,St Roberts Primary School Newtown,VIC,3220,Large,Y,,,,Y,,,,,,,Y,,,,,,Y,,,,,,,,,,,,,,,Y,,,,,,,
37131257175,Dmtc Limited,VIC,3122,Large,,,,,,,,,,Y,,,,Y,,,,,,,,,,,,Y,,,Y,,,,,,,,,,,
37160688671,St Thomas Primary School Drysdale,VIC,3222,Large,Y,,,,Y,,,,,,,Y,,,,,,Y,,,,,,,,,,,,,,,Y,,,,,,,
37178582004,The Trustee For Community Services Trust,VIC,3066,Small,Y,,,,,,,,,,,,Y,,,,,,,,,,,,,Y,,,,,,,,,,,,,,
37183326459,St Virgin Mary Coptic Orthodox Church,VIC,3031,Medium,Y,,,,,,,,,,,Y,,,,,,,,,,,,,,Y,,,,,,,,,,,,,,
37214338788,Camberwell City RSL Sub-Branch Welfare Patriotic Fund,VIC,3000,Small,Y,,,,,,,,,,,,,,,,,,,,,,,,,,,,,,,,,,,,Y,,,
37236738243,Indigenous Barristers' Trust,VIC,3000,Small,Y,,,,,,,,,,Y,,Y,,Y,Y,,,,,,,,,,,,,,,,,,,,,,,,
37261316537,The Yarra Link Project Incorporated,VIC,3142,Small,Y,,,,,,,Y,,,,,,,,,,,,,,,,,,Y,,,,,,,,,,,,,,
37339930909,St Mary Of The Assumption Catholic Church Keilor Downs/Kealba,VIC,3038,Medium,Y,,,,,,,,,,,Y,,,,,,,,,,,,,,Y,,,,,,,,,,,,,,
37369221082,The Trustee For The Grant Foundation,VIC,3121,Small,,,,,,,,Y,Y,Y,,,,,,,,,,,,,,,,Y,,,,Y,,,,,,,,,,
37386643863,GREEK ORTHODOX ARCHDIOCESE OF AUSTRALIA CONSOLIDATED TRUST GREEK ORTHODOX CHURCH THOMASTOWN,VIC,3074,Medium,Y,,,,,,,,,,,,,,,,,,,,,,,,,Y,,,,,,,,,,,,,,
37411684705,The King David School,VIC,3143,Large,Y,,,,Y,,,,,,,,,,,,,Y,,,,,,,,,,,,,,,,,,,,,,Y
37437614193,St Mary's School Lancefield,VIC,3435,Large,Y,,,,Y,,,,,,,Y,,,,,,Y,,,,,,,,,,,,,,,Y,,,,,,,
37496269760,Holy Saviour School Vermont South,VIC,3133,Large,Y,,,,Y,,,,,,,Y,,,,,,Y,,,,,,,,,,,,,,,Y,,,,,,,
37513950780,St Michaels Mt Dand Johnson 2,VIC,3000,Small,Y,,,,,,,,,,,Y,,,,,,,,,,,,,,Y,,,,,,,,,,,,,,
37514948711,The Trustee For A M G Dawson Bequest,VIC,3000,Small,Y,,,,,,,,,,,Y,,,,,,,,,,,,,,Y,,,,,,,,,,,,,,
37539127119,Geelong Spiritualist Church Inc.,VIC,3216,,Y,,,,,,,,,,,Y,,,Y,Y,Y,Y,,Y,,Y,Y,,Y,Y,Y,Y,Y,Y,,Y,,,Y,,,,Y,Y
37577861514,Dunkeld RSL Sub-Branch Welfare Patriotic Fund,VIC,3000,Small,Y,,,,,,,,,,,,,,,,,,,,,,,,,,,,,,,,,,,,Y,,,
37583009242,SWAN HILL RSL SUB-BRANCH PATRIOTIC FUND,VIC,3000,Small,Y,,,,,Y,,,,,,,Y,Y,,,,,,,,,,,,,,,,,,,,,,,Y,,,
37591463110,Anglican Trusts Corporation Of The Diocese Of Gippsland,VIC,3862,Small,Y,,,,,,,,,,,Y,,,,,,,,,,,,,,Y,,,,,,,,,,,,,,
37621753955,Pacific Women's Network Limited,VIC,3079,,Y,,,,,,,,,,,,Y,,,,,,,,,,,,,,,,,,,,,,,,,,,
37656736338,EdABLE FOODS Incorporated,VIC,3146,Small,Y,Y,,,,,,,,,,,Y,,,Y,,,,,,Y,Y,Y,,Y,Y,,,,,,Y,,,Y,,,,
37665490818,The Trustee For Edmund Rice Foundation Trust,VIC,3052,Small,Y,,,,,,,,,Y,,,,,,,,,,,,,,,,Y,,,Y,,,,,,,,,,,
37713649762,St Mary's School Yarram ,VIC,3971,Large,Y,,,,Y,,,,,,,Y,,,,,,Y,,Y,,,,,,,,,,,,,,,,,,,,
37766767683,Warrnambool Surf Life Saving Club Inc,VIC,3280,Medium,Y,Y,,,,,,,,,,,,Y,,,,Y,,,,,,,,Y,,,,,,,,,,,,,,Y
37805224258,Holy Family Catholic Church Doveton,VIC,3177,Small,Y,,,,,,,,,,,Y,,,,,,,,,,,,,,Y,,,,,,,,,,,,,,
37848360549,Cockatoo Neighbourhood House Inc,VIC,3781,Small,Y,,,,,,,,,,,,,,,,,,,,,,,Y,,,,,,,,,,,,,,,,
37865319519,Clairvaux Catholic School,VIC,3216,Large,Y,,,,Y,,,,,,,Y,,,,,,Y,,,,,,,,,,,,,,,Y,,,,,,,
37890152343,Rupanyup RSL Sub-Branch Welfare Patriotic Fund,VIC,3000,Small,Y,,,,,,,,,,,,,,,,,,,,,,,,,,,,,,,,,,,,Y,,,
37895403870,COBURG RSL SUB-BRANCH PATRIOTIC FUND,VIC,3000,Small,Y,,,,,,,,,,,,,,,,,,,,,,,,,,,,,,,,,,,,Y,,,
37907719455,Gippsland Grammar Old Scholars Association Be your Potential Scholarship Fund,VIC,0,Small,Y,,,,Y,,,,,,,,,,,,,Y,,,,,,Y,,,,,,,,,,,Y,,,,,Y
37917920531,St Patrick's School,VIC,3345,Large,Y,,,,Y,,,,,,,Y,,,Y,,,Y,,,,,,,,,,,,,,,Y,,,,,,,Y
37933813157,St Peter Apostle Primary School,VIC,3029,Large,Y,,,,Y,,,,,,,Y,,,,,,Y,,,,,,,,,,,,,,,Y,,,,,,,
37965190089,Bendigo Diocesan Trusts Corporation,VIC,3552,Small,Y,,,,,,,,,,,Y,,,,,,,,,,,,,,Y,,,,,,,,,,,,,,
37966810716,Projection Dance Company Inc,VIC,3689,Small,Y,,,Y,,,,,,,,,,,,,,Y,,,,,,,,,,,,,,,,,Y,,,,,
38006487663,Templestowe Baptist Church Incorporated,VIC,3109,Medium,Y,,,,,,,,,,,Y,,,,Y,Y,Y,,Y,Y,Y,Y,,,,Y,,,,,,,,,,,,,Y
38082701746,Mizrachi Charity Fund Ltd.,VIC,3162,,Y,Y,,,,,,,,,,,,,,,,,,,,,,,,,,,Y,,,,,,,,,,,
38223950243,SPRINGVALE RSL SUB-BRANCH PATRIOTIC FUND,VIC,3000,Medium,Y,,,,,Y,,,,,,,Y,Y,,,,,,,,,,,,,,,,,,,,,,,Y,,,
38246877601,St Theresa's Primary School Albion,VIC,3020,Large,Y,,,,Y,,,,,,,Y,,,,,,Y,,,,,,,,,,,,,,,Y,,,,,,,
38286799784,St John Vianney's School Mulgrave,VIC,3170,Large,Y,,,,Y,,,,,,,Y,,,,,,Y,,,,,,,,,,,,,,,Y,,,,,,,
38289393491,Loreto Mandeville Hall Toorak Limited,VIC,3142,Large,Y,,,,Y,,,,,,,Y,,,,,,Y,,Y,,,,,,,,,,,,,,,,,,,,Y
38292570905,Sacred Heart Primary School Preston,VIC,3072,Large,Y,,,,Y,,,,,,,Y,,,,,,Y,,,,,,,,,,,,,,,Y,,,,,,,
38293980154,OAKLEIGH CARNEGIE RSL SUB-BRANCH PATRIOTIC FUND,VIC,3000,Small,Y,,,,,Y,,,,,,,Y,Y,,,,,,,,,,,,,,,,,,,,,,,Y,,,
38306868571,East Malvern Rsl Sub Branch Incorporated,VIC,3145,Large,Y,,,,,Y,,,,,,,Y,Y,,,,,,,,,,,,Y,,,Y,,,,,,,,Y,,,
38318286045,Traralgon United Common Equity Rental Housing Co-operative Limited,VIC,3844,Small,Y,,,,,,,,,,,,Y,,,,,,,,,,,,,Y,,,,,,,,,,,,,,
38330915392,Trustee for Eldon and Anne Foote Trust,VIC,3000,,Y,,,,,,,,,,,,,,,,,,,,,,,,,,,,Y,,,,,,,,,,,
38354017532,The Trustee For Harold Klinger Bequest,VIC,3000,Small,Y,,,,,,,,,,,Y,,,,,,,,,,,,,,Y,,,,,,,,,,,,,,
38362886869,Elwood/St Kilda West Parish,VIC,3184,Medium,Y,,,,,,,,,,,Y,,,,,,,,,,,,,,Y,,,,,,,,,,,,,,
38369594313,O'Brien Real Estate Foundation,VIC,3148,Small,Y,,,,,,,,,Y,,,,,,,,,,,,,,,,Y,,,,Y,,,,,,,,,,
38387689400,The Trustee For Isabel Edith Jones Bequest,VIC,3000,Small,Y,,,,,,,,,,,Y,,,,,,,,,,,,,,Y,,,,,,,,,,,,,,
38466162540,Bendigo Diocesan Trusts Corportation,VIC,3552,Small,Y,,,,,,,,,,,Y,,,,,,,,,,,,,,Y,,,,,,,,,,,,,,
38470080083,The Anxious Paddler Foundation,VIC,3165,Small,Y,,,,,Y,,,,,,,,,,,,,,,,,,,,Y,,,,,,,,,,,,,,
38515028392,Tongala RSL Sub-Branch Welfare Patriotic Fund,VIC,3000,Small,Y,,,,,,,,,,,,,,,,,,,,,,,,,,,,,,,,,,,,Y,,,
38518936577,East Leigh Gospel Chapel,VIC,3165,Small,Y,,,,,,,,,,,Y,,,,,,,,,,,,,,Y,,,,,,,,,,,,,,
38532871936,Ballan RSL Sub-Branch Patriotic Fund,VIC,3000,Small,Y,,,,,Y,,,,,,,Y,Y,,,,,,,,,,,,,,,,,,,,,,,Y,,,
38559417041,St Mary's School,VIC,3352,Medium,Y,,,,Y,,,,,,,Y,,,Y,,,Y,,,,,,,,,,,,,,,Y,,,,,,,Y
38581199495,The Ambrose Galvin Charitable Trust,VIC,3000,,Y,,,,,Y,,,,Y,,,Y,,,,,,,,,,,,,,,,,,,,,,,,,,,
38608109440,Tech 2 Kids,VIC,3000,Small,Y,,,,Y,,,,,,,,Y,,,,,Y,,,,,,,,,,,,,,,,,,,,,,
38609405003,Reseed (Indico) Ltd,VIC,3068,Small,Y,,,,Y,,,,,,,,,,,Y,,,,,,,,,,,,,,,,,,,,,,,,
38612529674,Hester Hornbrook Academy Ltd,VIC,3205,Large,Y,Y,,,,,,,,,,,Y,,,,,,,,,,,,,,,,,,,,,,,,,,,Y
38632381527,Kollel Chibas Jerusalem Charity Fund Limited,VIC,3161,,Y,Y,,,,,,,,,,,Y,,,,,,,,,,,Y,,,,,,,,,,,,,,,,
38633820168,Bethany Community Support Inc,VIC,3215,Large,Y,Y,,,,,,,,,,,Y,,Y,Y,Y,Y,,Y,Y,Y,Y,Y,Y,Y,Y,Y,,,Y,,Y,,Y,Y,,Y,,Y
38674108413,Steer Albert R. Bequest,VIC,3000,Small,Y,,,,,,,,,,,Y,,,,,,,,,,,,,,Y,,,,,,,,,,,,,,
38774082495,Holy Saviour Catholic Church Glen Waverley North,VIC,3133,Small,Y,,,,,,,,,,,Y,,,,,,,,,,,,,,Y,,,,,,,,,,,,,,
38788328554,Providing All Living Supports (Pals) Inc,VIC,3730,Large,Y,Y,,,,,,,,,,,,,Y,Y,Y,,,,Y,,Y,,,,Y,,,,,,Y,,Y,,,,,Y
38820113229,Payne Catherine Memorial Fund,VIC,3000,Small,Y,,,,,,,,,,,Y,,,,,,,,,,,,,,Y,,,,,,,,,,,,,,
38826799374,Lorne Surf Life Saving Club Inc (Reg. No. A0007451U),VIC,3232,Large,Y,Y,,,,,,,,,,,,,,,,,,,,,,,,Y,,,,,,,,,,,,,,
38839521067,The Trustee For Clifton Hill Presbyterian Church,VIC,3068,Small,Y,,,,,,,,,,,Y,,,,,,,,,,,,,,Y,,,,,,,,,,,,,,
38873032344,Radiant Church,VIC,0,Small,Y,,,,,,,,,,,Y,,,,,,,,,,,,,,Y,,,,,,,,,,,,,,
38908755374,ROMAN CATHOLIC DIOCESE OF BALLARAT CLERGY SUPPORT FUND,VIC,3350,,Y,Y,,,,,,,,,,,,,,,Y,,,,,,,,,,,,,,,,,,,,,,,
38955707429,The Melbourne Grammar School Foundation,VIC,3004,Large,Y,,,,Y,,,,,,,,,,,,,Y,,,,,,,,,,,,,,,,,,,,,,Y
39003125142,Melbourne Hebrew Congregation,VIC,3141,Medium,Y,,,,,,,,,,,Y,,,,,,,,,,,,,,Y,,,,,,,,,,,,,,
39003199488,Arrow Leadership Australia Limited,VIC,3103,Medium,Y,,,,,,,,,,,Y,,,,Y,,,,,,,,,,,,,,,,,,,,,,,,
39004483549,Lutheran Church Of Australia Victorian District St James Moorabbin,VIC,3189,Small,Y,,,,,,,,,,,Y,,,,Y,Y,Y,,Y,Y,Y,Y,,,Y,Y,Y,,,,Y,Y,,,,,,,Y
39004717300,Rossbourne School,VIC,3122,Large,Y,Y,,,Y,,,,,,,,,,,,,Y,,,,,,,,,,,,,,,Y,,,,,,,Y
39031591026,St Liborius Primary School,VIC,3556,Large,Y,,,,Y,,,,,,,Y,,,,,,Y,,,,,,,,,,,,,,,,,,,,,,
39081026168,Ballarat Arts Foundation Inc,VIC,3350,Small,Y,,,Y,Y,,,,,,,,,,,Y,,,,,,,,,,,,,,,,,,,,,,,,Y
39142046497,The Trustee For Melbourne High School Arts And Cultural Trust,VIC,3141,Small,Y,,,,Y,,,,,,,,,,,,,,,,,,,,,,,,,,,,,,,,,,,Y
39193084760,St Leo's Altona North Parish School Board,VIC,3025,Large,Y,,,,Y,,,,,,,Y,,,,,,Y,,,,,,,,,,,,,,,Y,,,,,,,
39221509198,Psoriasis Australia Incorporated,VIC,3053,Small,Y,Y,,,,Y,,,,,,,,,,,,,,,,,,,,Y,,,,,,,,,,,,,,
39223038090,St Josephs School Elsternwick,VIC,3185,Large,Y,,,,Y,,,,,,,Y,,,,,,Y,,,,,,,,,,,,,,,Y,,,,,,,
39238335075,PASCOE VALE RSL SUB-BRANCH PATRIOTIC FUND,VIC,3000,Small,Y,,,,,Y,,,,,,,Y,Y,,,,,,,,,,,,,,,,,,,,,,,Y,,,
39248199714,Catholic Charismatic Renewal Melbourne,VIC,3068,Small,Y,,,,,,,,,,,Y,,,,,,,,,,,,,,Y,,,,,,,,,,,,,,
39260113685,Young Achievers Common Equityrental Housing Co Operative Ltd,VIC,3556,Small,Y,,,,,,,,,,,,,,,,,,,,,,,,,Y,,,,,,,,,,,,,,
39275302584,Rsl Victorian Branch Welfare Trust Fund,VIC,3000,Small,Y,,,,,,,,,,,,,,,,,,,,,,,,,,,,,,,,,,,,Y,,,
39408106253,Kind Hearted Lankans Inc.,VIC,3003,,Y,Y,,,,,,,,,,,Y,,,,,,,,,,,,,,,,,,,,,,,,,,,
39409262215,GLENROY RSL SUB-BRANCH PATRIOTIC FUND,VIC,3000,Medium,Y,,,,,Y,,,,,,,Y,Y,,,,,,,,,,,,,,,,,,,,,,,Y,,,
39424731320,RETURNED NURSES RSL SUB-BRANCH PATRIOTIC FUND,VIC,3000,Small,Y,,,,,Y,,,,,,,Y,Y,,,,,,,,,,,,,,,,,,,,,,,Y,,,
39457814349,St Josephs Primary School Beechworth,VIC,3747,Large,Y,,,,Y,,,,,,,,,,,,,Y,,,,,,,,,,,,,,,,,,,,,,
39568983836,The Trustee For A C Sage Gift,VIC,3000,Small,Y,,,,,,,,,,,Y,,,,,,,,,,,,,,Y,,,,,,,,,,,,,,
39570447010,Uca - Ararat West Uniting Church Property Board,VIC,3377,Small,Y,,,,,,,,,,,Y,,,,,Y,,,,,,,,,,,,,,,,,,,,,,,
39585587367,United Cultural Partnerships Incorporated,VIC,3141,,Y,,,Y,,,,,,,,,,,,,,,,,,,,,,Y,,,,Y,,,,,,,,,,
39597126697,The Trustee For Eliza Crawford Curate Fund Christ Church St Kilda,VIC,3000,Small,Y,,,,,,,,,,,Y,,,,,,,,,,,,,,Y,,,,,,,,,,,,,,
39603559744,COMMITTEE FOR MELBOURNE LTD.,VIC,3000,,Y,,,,,,,,,Y,,,,,,,,,,,,,,,,Y,,,,,,,,,,,,,,
39604292346,Mary Glowrey Heritage Limited,VIC,3065,Small,Y,,,Y,,,,,,,,,,,,Y,Y,,,,,Y,,,,,,,,,,,,,,,,,,Y
39616523730,Cornish College,VIC,3175,Large,Y,,,,Y,,,,,,,,,,,,,Y,,Y,,,,,,,,,,,,,,,,,,,,
39649869626,Uca Mooroopna Parish,VIC,3629,Small,Y,,,,,,,,,,,Y,,,,,,,,,,,,,,Y,,,,,,,,,,,,,,
39652061060,The Trustee For Kinglake Ranges Foundation Trust,VIC,3763,Small,Y,,,,Y,,,,,,,,Y,,,,,,,,,,,,,,,,,,,,,,Y,,,,Y,
39664126021,St Mary Magdalens Catholic Church Jordanville,VIC,3148,Small,Y,,,,,,,,,,,Y,,,,,,,,,,,,,,Y,,,,,,,,,,,,,,
39683389845,Street Feed,VIC,3124,Small,,,,,,,,,,,,,Y,,,,,,,,,,,,,,,,,,,,,,,,,,,
39710669171,The Trustee For J M Smith Trust,VIC,3000,Small,Y,,,,,,,,,,,Y,,,,,,,,,,,,,,Y,,,,,,,,,,,,,,
39795858934,Support For Refugees Incorporated,VIC,3123,,Y,Y,,,,,,,,,,,Y,,,,,,,,,,,,,,,Y,,,,,,,,,,,,
39808636943,Victorian Croatian Aged Care Services Incorporated As the Operator of a PBI,VIC,3000,Small,Y,Y,,,,,,,,,,,,,,,Y,,,,,Y,,,,,,,,,,,,,,,,,,
39837706272,The Trustee For The East Preston Islamic College Building Fund,VIC,3072,Large,Y,,,,Y,,,,,,,,,,,,,Y,,Y,,,,,,,,,,,,,,,,,,,,Y
39857367477,The Trustee For Ripponlea Endowment Fund,VIC,3175,Medium,Y,,,,,,,,,,,,,,,,,,,,,,,,,,,,,Y,,,,,,,,,,
39863450054,Good Shepherd Early Childhood Services,VIC,3300,Large,Y,,,,,,,,,,,Y,Y,,,,,,,Y,,,,,,,,,,,,,,,,,,,,
39926673059,St Kevins College,VIC,3142,Large,Y,,,,Y,,,,,,,Y,,,Y,,,Y,,,,,,,,,,,,,,,,,,,,,,Y
39992360026,Bendigo Diocesan Trusts Corporation,VIC,3552,Small,Y,,,,,,,,,,,Y,,,,,,,,,,,,,,Y,,,,,,,,,,,,,,
40041783778,Ballarat And District Genealogical Society Inc,VIC,3350,Small,,,,,,,,,,,,,,,,,,,,,,,,,,Y,,,Y,,,,,,,,,,,
40145727493,Lachlan O'Brien Fund Limited,VIC,3142,Small,Y,,,,,,,,,,,,,,,,,,,,,,,,,,,,,,,,Y,,,,,,,
40147741526,FCJ College Benalla,VIC,3672,Large,Y,,,,Y,,,,,,,Y,,,,,,Y,,,,,,,,,,,,,,,,,,,,,,
40153259203,St Luke's Anglican Church Vermont,VIC,3133,Small,Y,,,,,,,,,,,Y,,,,,,,,,,Y,,,,,,,,,,,,,,,,,,
40154259871,Immaculate Conception Catholic Church Hawthorn,VIC,3122,Medium,Y,,,,,,,,,,,Y,,,,,,,,,,,,,,Y,,,,,,,,,,,,,,
40164421700,Uca Lockington Uniting Church Parish,VIC,3561,Small,Y,,,,,,,,,,,Y,,,,,,,,,,,,,,Y,,,,,,,,,,,,,,
40168559778,Discovery Community Church Inc.,VIC,3749,Small,Y,,,,,,,,,,,Y,,,,,,,,,,,,,,Y,,,,,,,,,,,,,,
40199833663,Public Galleries Association Of Victoria,VIC,8004,Medium,Y,,,Y,,,,,,,,,,,,,,,,,,,,,,Y,,,,,,,,,Y,,,,,
40239508980,Heytesbury District Landcare Network Inc,VIC,3268,Medium,Y,,,,,,,Y,,,,,,,,,,,,,,,,,,,,,,,,,,,Y,,,,,
40313623203,Malvern Russian Community School,VIC,3145,Small,Y,,,,,,,,,,,,,,,,,Y,,Y,,,,,,,,,,,,,,,,,,,,
40322643843,Auspicious Arts Projects Inc,VIC,3066,Large,Y,,,Y,,,,,,,,,,,Y,,,,,,,,,,Y,Y,,,Y,,,,Y,,Y,,,,,
40355220698,St Clement Of Rome Primary School,VIC,3105,Large,Y,,,,Y,,,,,,,Y,,,,,,Y,,,,,,,,,,,,,,,Y,,,,,,,
40411353768,The Properties Corporation Of The Churches Of Christ,VIC,3205,Large,Y,,,,,,,,,,,Y,,,,,,,,,,,,,,,,,,Y,,,,,,,,,,
40416107108,Arthurs Creek District Landcare Group,VIC,0,Small,Y,,,,,,,Y,,,,,,,,,,,,,,,,,,Y,,,,,,,,,,,,,,
40467733457,The Loreto Mandeville Hall Association Inc. Building Fund,VIC,3142,Small,Y,,,,,,,,,,,,,,,,,Y,,Y,,,,,,,,,,,,,,,,,,,,Y
40471458442,St Annes School Seaford,VIC,3198,Large,Y,,,,Y,,,,,,,Y,,,,,,Y,,,,,,,,,,,,,,,Y,,,,,,,
40534702470,The Trustee For St Marks Wallan Endowment Fund,VIC,3000,Small,Y,,,,,,,,,,,Y,,,,,,,,,,,,,,Y,,,,,,,,,,,,,,
40536353039,Mollison Library Trust,VIC,3000,Small,Y,,,,,,,,,,,Y,,,,,,,,,,,,,,Y,,,,,,,,,,,,,,
40557169396,St Pauls Catholic Church West Sunshine,VIC,3020,Small,Y,,,,,,,,,,,Y,,,,,,,,,,,,,,Y,,,,,,,,,,,,,,
40557982129,Toy Libraries Australia Inc.,VIC,3067,Medium,Y,,,,Y,,,,,Y,,,Y,,,,,Y,,Y,,Y,Y,,,Y,,,,,,,,,,,,,,
40578109371,St Marys Primary School Geelong,VIC,3220,Large,Y,,,,Y,,,,,,,Y,,,,,,Y,,,,,,,,,,,,,,,Y,,,,,,,
40584879243,The Roebuck Foundation,VIC,3036,Small,Y,,,,,,,,,Y,,,,,,,,,,,,Y,,,,,,,Y,,,,,,,,,,,
40586517862,St Mary's Primary School Alexandra,VIC,3714,Large,Y,,,,Y,,,,,,,Y,,,,,,Y,,,,,,,,,,,,,,,Y,,,,,,,
40593251144,Basalt to Bay Land Care Network Inc,VIC,3282,Small,Y,,,,,,,Y,,,,,,,,,,,,,,Y,Y,,,Y,Y,,Y,,,,,,,,,,,
40594141285,Raaf Veteran's Residences Trust,VIC,3028,Medium,Y,Y,,,,,,,,Y,,,Y,,,,,,,,,,,,,,,,,,,,,,,,Y,,,
40672367613,St Pauls Anglican Grammar School Library Fund,VIC,3820,Small,Y,,,Y,,,,,,,,,,,,,,Y,,Y,,,,,,,,,,,,,,,,,,,,Y
40696392866,Swap and Geek Incorporated,VIC,3204,,Y,,,Y,,,,,,,,,,,,,,,,,,,,,,Y,,,,,,,,,,,,,,
40730466137,St Mary's School Donald,VIC,3480,Large,Y,,,,Y,,,,,,,Y,,,Y,,,Y,,,,,,,,,,,,,,,Y,,,,,,,Y
40758628039,Friends Of Monash Gallery Of Art Inc,VIC,3150,Small,Y,,,Y,,,,,,,,,,,,,,,,,,,,,,,,,Y,,,,,,,,,,,
40815860620,The Trustee For Hughes Cheong Lectureship Trust,VIC,3000,Small,Y,,,,,,,,,,,Y,,,,,,,,,,,,,,Y,,,,,,,,,,,,,,
40830189929,Uca Corangamite Shared Ministry,VIC,3260,Small,Y,,,,,,,,,,,Y,,,,,,,,,,,,,,Y,,,,,,,,,,,,,,
40849663739,St Mary's Primary School Maffra,VIC,3860,Large,Y,,,,Y,,,,,,,Y,,,,,,Y,,Y,,,,,,,,,,,,,,,,,,,,
40877135769,N W K Common Equity Rental Housing Co Operative Ltd,VIC,3442,Small,Y,,,,,,,,,,,,,,,,,,,,,,,,,Y,,,,,,,,,,,,,,
40891019823,St Pauls Primary School Coburg,VIC,3058,Large,Y,,,,Y,,,,,,,Y,,,,,,Y,,,,,,,,,,,,,,,Y,,,,,,,
40899043494,Uca-St Johns Streatham,VIC,3351,Small,Y,,,,,,,,,,,,,,,,,,,,,,,,,Y,,,,,,,,,,,,,,
40924102842,Strathewen Landcare Group Incorporated,VIC,3099,Small,Y,,,,,,,Y,,,,,,,,,,,,,,Y,,,,,,,,,,,,,,,,,,
40932771499,Our Lady Of The Way Catholic School,VIC,3083,Large,Y,,,,Y,,,,,,,Y,,,,,,Y,,,,,,,,,,,,,,,Y,,,,,,,
40985574897,Australian Syrian Charity Incorporated,VIC,3056,,Y,Y,,,,,,,,,,,Y,,,,,,,,,,,Y,,,,Y,,,,,,,,,,,,
40991706204,St Mary's Catholic Church Hastings,VIC,3915,Small,Y,,,,,,,,,,,Y,,,,,,,,,,,,,,Y,,,,,,,,,,,,,,
41004522589,Janet Clarke Hall,VIC,3052,Large,Y,,,,Y,,,,,,,,,,,,,,,,,,,,,,,,,,,,,,,,,,,Y
41007271465,St Carlo Borromeo School,VIC,3059,Large,Y,,,,Y,,,,,,,Y,,,,,,Y,,,,,,,,,,,,,,,Y,,,,,,,
41009076787,Anglican Trusts Corporation Of The Diocese Of Gippsland,VIC,3871,Small,Y,,,,,,,,,,,Y,,,,,,,,,,,,,,Y,,,,,,,,,,,,,,
41058535863,Melbourne International Festival Of The Arts Limited,VIC,8009,Large,Y,,,Y,,,,,,,,,,,,,,,,,,,,,,Y,,,,,,,,,,,,,,
41087675106,Loch Sport Senior Citizens Club Inc,VIC,3851,Small,Y,,,,,,,,,,,,,,,,Y,,,,,,Y,,,,Y,,,,,,,,,,,,,
41089933898,Vinnies Kitchen Inc,VIC,3939,Small,Y,Y,,,,,,,,,,,,,,Y,,Y,,,,,Y,Y,,Y,Y,,,,,,,,,,,,,Y
41097159914,Australian Brick & Blocklaying Training Foundation Ltd,VIC,3189,Large,Y,,,,Y,,,,,,,,,,Y,Y,,,,,Y,,Y,Y,Y,,Y,Y,,,Y,,Y,Y,Y,Y,Y,,,Y
41102721336,Parents And Friends Of Tarnagulla,VIC,3551,Small,Y,,,,Y,,,,,,,,,,,,,Y,,,,,,,,,,,Y,,,,,,,,,,,
41125598986,NUMURKAH RSL SUB-BRANCH PATRIOTIC FUND,VIC,3000,Small,Y,,,,,Y,,,,,,,Y,Y,,,,,,,,,,,,,,,,,,,,,,,Y,,,
41156017446,Beaufort Municipal Band Inc,VIC,3373,Small,Y,,,,,,,,,,,,,,,,Y,Y,,,,Y,,,,,,,,,,,,,Y,,,,,
41172497387,St Ita's Catholic Church - Drouin,VIC,3820,Small,Y,,,,,,,,,,,Y,,,,,,,,,,,,,,Y,,,,,,,,,,,,,,
41180800336,The Tweddle Foundation Public Fund,VIC,3011,,Y,,,,,Y,,,,Y,,,,,,,,,,,,,,,,Y,,,,,,,,,,,,,,
41200387372,Holy Trinity Parish,VIC,3165,Medium,Y,,,,,,,,,,,Y,,,,,,,,,,,,,,Y,,,,,,,,,,,,,,
41235495866,St Thomas The Apostle Catholic Church Blackburn Parish,VIC,3130,Medium,Y,,,,,,,,,,,Y,,,,,,,,,,,,,,Y,,,,,,,,,,,,,,
41237634882,CORRYONG RSL SUB-BRANCH PATRIOTIC FUND,VIC,3000,Small,Y,,,,,Y,,,,,,,Y,Y,,,,,,,,,,,,,,,,,,,,,,,Y,,,
41238492203,St John The Beloved Liberal Catholic Church,VIC,3146,Small,Y,,,,,,,,,,,Y,,,,,,,,,,,,,,Y,,,,,,,,,,,,,,
41243717566,The Trustee For Father George Maltby Scholarship Fund,VIC,3125,Small,,,,,,,,,,,,,,,,,,,,,,,,,,,,,,,,,,,,,,,,
41255197577,Astra Chamber Music Society,VIC,3051,Small,Y,,,Y,,,,,,,,,,,,,,,,,,,,,,Y,,,Y,,,,,,,,,,,
41433541731,St Brendan's School,VIC,3352,Medium,Y,,,,Y,,,,,,,Y,,,Y,,,Y,,,,,,,,,,,,,,,Y,,,,,,,Y
41440017173,The Trustee For The Edward Arthur Austin Bequest,VIC,3000,Small,Y,,,,,,,,,,,Y,,,,,,,,,,,,,,Y,,,,,,,,,,,,,,
41440484354,Katharine St Clair Nanson Charitable Trust - RSPCA Account,VIC,3001,Small,Y,,Y,,,,,,,,,,,,,,,,,,,,,,,,,,,Y,,,,,,,,,,
41447619342,Melbourne Holy City Movement Inc,VIC,3053,,Y,,,,,,,,,,Y,Y,,,,,,,,,,,,,,,,,,,,,,,,,,,,
41479096228,St Peter Julian Eymard School,VIC,3138,Large,Y,,,,Y,,,,,,,Y,,,,,,Y,,,,,,,,,,,,,,,Y,,,,,,,
41534990348,Hampton Rsl Sub-Branch Incorporated,VIC,3188,Medium,Y,,,,,,,,,,,,,,,,,,,,,,,,,,,,,,,,,,,,Y,,,
