ABN,Charity_Legal_Name,State,Postcode,Charity_Size,Operates_in_VIC,PBI,Preventing_or_relieving_suffering_of_animals,Advancing_Culture,Advancing_Education,Advancing_Health,Promote_or_oppose_a_change_to_law__government_poll_or_prac,Advancing_natual_environment,Promoting_or_protecting_human_rights,Purposes_beneficial_to_ther_general_public_and_other_analogous,Promoting_reconciliation__mutual_respect_and_tolerance,Advancing_Religion,Advancing_social_or_public_welfare,Advancing_security_or_safety_of_Australia_or_Australian_public,Aboriginal_or_TSI,Adults,Aged_Persons,Children,Communities_Overseas,Early_Childhood,Ethnic_Groups,Families,Females,Financially_Disadvantaged,Gay_Lesbian_Bisexual,General_Community_in_Australia,Males,Migrants_Refugees_or_Asylum_Seekers,Other_Beneficiaries,Other_Charities,People_at_risk_of_homelessness,People_with_Chronic_Illness,People_with_Disabilities,Pre_Post_Release_Offenders,Rural_Regional_Remote_Communities,Unemployed_Person,Veterans_or_their_families,Victims_of_crime,Victims_of_Disasters,Youth
11005151771,Braemar College Limited,VIC,3442,Large,Y,,,,Y,,,,,,,,,,,,,Y,,,,,,,,,,,,,,,,,,,,,,Y
11007434362,Alphington Grammar School,VIC,3078,Large,Y,,,,Y,,,,,,,,,,,,,Y,,,,,,,,,,,,Y,,,Y,,,,,Y,,
11036231838,The Trustee For The Foundation For Imaging Research,VIC,3008,Medium,Y,,,,,Y,,,,,,,,,,,,,,,,,,,,,,,Y,,,,,,,,,,,
11062802797,Community Housing Limited,VIC,3128,Large,Y,Y,,,,,,,,,,,,,,,,,,,,,,,,Y,,,,,,,,,,,,,,
11076178673,Dolphin Common Equity Rental Housing Co-Operative Ltd,VIC,3199,Small,Y,,,,,,,,,,,,,,,,,,,,,,,,,Y,,,,,,,,,,,,,,
11092150879,Nyahwest Uniting Church Council,VIC,3591,Small,Y,,,,,,,,,,,Y,,,,,,,,,,,,,,Y,,,,,,,,,,,,,,
11129790467,Doxa Community Club Incorporated,VIC,3003,Large,Y,Y,,,,,,,,,,,Y,,,,,,,,,,,,,,,,,Y,,,,,,,,,,
11131047268,MAS National Limited,VIC,3070,Large,Y,,,,Y,,,,,,,,,,,,,,,,,,,,,Y,,,,,,,,,,,,,,
11165171840,Baptist Church Altona,VIC,3018,Small,Y,,,,,,,,,,,Y,,,Y,Y,Y,Y,,Y,Y,Y,Y,Y,Y,,Y,Y,,,Y,Y,Y,Y,,Y,Y,Y,Y,Y
11165869061,Mallacoota RSL Sub-Branch Patriotic Fund,VIC,3000,Small,Y,,,,,Y,,,,,,,Y,Y,,,,,,,,,,,,,,,,,,,,,,,Y,,,
11167192752,Olivia Newton-John Cancer Research Institute,VIC,3084,Large,Y,,,,,Y,,,,,,,,,,,,,,,,,,,,,,,,,,Y,,,,,,,,
11192522543,St Christophers Anglican Church East Bentleigh,VIC,3165,Small,Y,,,,,,,,,,,Y,,,,,Y,,,,,,,,,Y,,,,Y,,,,,Y,,,,,
11237942413,St Mary's Parish School Inglewood,VIC,3517,Large,Y,,,,Y,,,,,,,Y,,,,,,Y,,,,,,,,,,,,,,,,,,,,,,
11252634894,Inglewood-Bridgewater RSL Sub-Branch Patriotic Fund,VIC,3000,Small,Y,,,,,,,,,,,,,,,,,,,,,,,,,,,,,,,,,,,,Y,,,
11274192974,University Of Melbourne Graduate Student Association Inc,VIC,3010,Large,Y,,,,Y,,,,,,,,,,Y,Y,,,,,Y,Y,Y,Y,Y,Y,Y,Y,Y,,Y,,,,,Y,,,,Y
11276993085,Newhope Baptist Pre-School Inc,VIC,3130,Medium,Y,,,,Y,,,,,,,,,,,,,,,Y,Y,Y,,,,,,,,,,,Y,,,,,,,
11296525689,Tamanna,VIC,3064,,Y,,,Y,Y,,,,,,,,Y,,,,,,Y,,Y,,,,,,,,,,,,,,,,,,,
11301552846,Victoria's Heritage Restoration Fund Inc,VIC,3002,Medium,Y,,,,,,,,,,,,,,,,,,,,,,,,,Y,,,,,,,,,,,,,,
11328366859,The Gwen & Edna Jones Foundation,VIC,3280,Large,Y,,,,,,,,,,,,,,,,,,,,,,,,,Y,,,Y,,,,,,,,,,,
11389597881,South Melbourne Life Saving Club Inc,VIC,3206,Small,Y,Y,,,,,,,,,,,,,,,,,,,,,,,,Y,,,Y,,,,,,,,,,Y,
11391301149,Greek Orthooox Archdiocese Ofaustralia Parish Of Coburg And Pascoevale,VIC,3058,Medium,Y,,,,,,,,,,,Y,,,,,,,,,,,,,,Y,,,,,,,,,,,,,,
11403509906,St Marys Catholic Church,VIC,3796,Small,Y,,,,,,,,,,,Y,,,,,,,,,,,,,,Y,,,,,,,,,,,,,,
11453217641,MENTONE RSL SUB-BRANCH PATRIOTIC FUND,VIC,3000,Small,Y,,,,,Y,,,,,,,Y,Y,,,,,,,,,,,,,,,,,,,,,,,Y,,,
11460996012,Bendigo Diocesan Trusts Corporation,VIC,3552,Small,Y,,,,,,,,,,,Y,,,,,,,,,,,,,,Y,,,,,,,,,,,,,,
11472625252,Simonds Catholic College West Melbourne,VIC,3003,Large,Y,,,,Y,,,,,,,Y,,,,,,Y,,,,,,,,,,,,,,,Y,,,,,,,Y
11477560139,The Every Life Matters (ELM) Network,VIC,3450,,Y,,,,,Y,,,,,,,,,,,,,,,,,,,,,,,,,,,,,,,,,,
11478617475,St Finbar's Catholic Church Brighton East,VIC,3187,Small,Y,,,,,,,,,,,Y,,,,,,,,,,,,,,Y,,,,,,,,,,,,,,
11507709511,Northern District Community Health,VIC,3579,Large,Y,,,Y,,Y,,,,,Y,,Y,,Y,Y,Y,Y,,Y,Y,Y,Y,Y,Y,,Y,Y,,,Y,Y,Y,Y,Y,Y,Y,Y,Y,Y
11512629602,Broadford Presbyterian Church,VIC,3658,Small,Y,,,,,,,,,,,Y,,,,Y,Y,Y,,Y,,Y,Y,,,,Y,,,,,,,,,,,,,Y
11538514248,Iglesia De La Profecia Nueva Rosa De Saron Inc,VIC,3020,Small,Y,,,,,,,,,,,Y,,,,,,,,,,,,,,Y,,,,,,,,,,,,,,
11541096517,Sacred Heart Primary School Oakleigh,VIC,3166,Large,Y,,,,Y,,,,,,,Y,,,,,,Y,,,,,,,,,,,,,,,Y,,,,,,,
11552937411,THE TRUSTEE FOR THE SILBERSCHER FAMILY FOUNDATION,VIC,3121,Large,,,,,,,,,,,,,,,,Y,Y,Y,,Y,Y,Y,Y,,,,Y,,,,,Y,,,,,,,,Y
11563991556,St Mary's School,VIC,3032,Small,Y,,,,Y,,,,,,,Y,,,,,,Y,,,,Y,Y,,,,Y,,,,,,Y,,,,,,,
11586072130,Holy Eucharist and St Mary's Malvern East,VIC,3145,Medium,Y,,,,,,,,,,,Y,,,,,,,,,,,,,,Y,,,,,,,,,,,,,,
11607342399,Uca - West Hawthorn,VIC,3122,Small,Y,,,,,,,,,,,Y,,,,Y,Y,,,,Y,Y,Y,Y,,,Y,,,,Y,Y,Y,,,Y,,,,Y
11635644874,Our Lady Help Of Christians Primary School East Warrnambool Victoria,VIC,3280,Large,Y,,,,Y,,,,,,,Y,,,Y,,,Y,,,,,,,,,,,,,,,Y,,,,,,,Y
11682476849,Greek Orthodox Archdiocese Of Aust East Keilor Ladies Auxiliary,VIC,3033,Small,Y,,,,,,,,,,,Y,,,,,,,,,,,,,,Y,,,,,,,,,,,,,,
11772492733,The Australian Baby Box Project Inc.,VIC,3166,,Y,,,,,Y,,,,,,,,,,,,,,,,,,,,,,,,,,,,,,,,,,
11852749072,Roman Catholic Trusts Corp For The Diocese Of Ballarat,VIC,3350,Small,Y,,,,,,,,,,,Y,,,,,,,,,,,,,,,,,,Y,,,,,,,,,,
11869057704,St Eleftherios Monastery of Mt Athos Foundation,VIC,3000,Small,Y,,,,,,,,,,,Y,,,,,,,,,,,,,,Y,,,,Y,,,,,,,,,,
11916913870,Uca - Camperdown,VIC,3260,Small,Y,,,,,,,,,,,Y,,,,,,,,,,,,,,Y,,,,,,,,,,,,,,
11952841906,Mount Evelyn Presbyterian Church,VIC,3796,Small,Y,,,,,,,,,,,Y,,,,Y,Y,Y,Y,Y,Y,Y,Y,Y,,,Y,Y,,Y,Y,Y,Y,,Y,,,,,
11973523604,Jesuit College of Spirituality,VIC,3052,Medium,Y,,,,,,,,,,,,,,,,,,,,,,Y,,,Y,Y,,Y,,,,,,,,,,,
11990678761,St Brendan's School Coragulac,VIC,3249,Large,Y,,,,Y,,,,,,,Y,,,Y,,,Y,,,,,,,,,,,,,,,Y,,,,,,,Y
12041298204,Interserve Development Limited,VIC,3153,Large,Y,Y,,,,,,,,,,Y,,,,,,,Y,,Y,,Y,,,,Y,Y,Y,,Y,,Y,,,,,,,
12077296483,Balwyn RSL Sub-Branch Patriotic Fund,VIC,3000,Small,Y,,,,,Y,,,,,,,Y,Y,,,,,,,,,,,,,,,,,,,,,,,Y,,,
12102649968,The Trustee For Community Enterprise Charitable Fund,VIC,3550,Large,,,,,,,,,,Y,,,,,,,,,,,,Y,,,,,,,,Y,,,,,,,,,,
12131486228,Dingee Bush Nursing Centre Incorporated,VIC,3571,Medium,Y,,,,,Y,,,,,,,,,,Y,Y,,,,,,Y,,,Y,Y,Y,,,,,,,Y,,,,,
12141611234,Melbourne Indigenous Transition School,VIC,3121,Large,Y,Y,,,,,,,,,,,,,Y,,,Y,,,,,,,,,,,,,,,,,,,,,,
12152039573,Merri Common Equity Rentalhousing Co-Operative Ltd,VIC,3070,Small,Y,,,,,,,,,,,,,,,,,,,,,,,,,Y,,,,,,,,,,,,,,
12162234589,Hartley Ridge/Singleton Preschool Association Incorporated,VIC,3802,Small,Y,,,,Y,,,,,,,,,,,,,,,Y,,Y,,,,,,,,,,,,,,,,,,
12201708163,The Trustee For The Hugh D T Williamson Foundation Trust,VIC,3001,Large,Y,,,,,,,,,Y,,,,,,,,,,,,,,,,,,,,Y,,,,,,,,,,
12208406096,Birchip RSL Sub-Branch Patriotic Fund,VIC,3000,Small,Y,,,,,Y,,,,,,,Y,Y,,,,,,,,,,,,,,,,,,,,,,,Y,,,
12234347734,Bidwell-Maap Aboriginal Corporation,VIC,3909,,,Y,,,,,,,,,,,,,Y,,,,,,,,,,,,,,,,,,,,,,,,,
12274345626,Hamilton Pastoral & Agricultural Society Inc.,VIC,3300,Medium,Y,,,,,,,,,,,,,,,,,,,,,,,,,Y,,,,,,,,,,,,,,
12295768733,Feeding Young Minds Inc,VIC,3166,Small,Y,,,,Y,,,,,,,,,,Y,Y,Y,,,,Y,Y,Y,Y,Y,Y,Y,Y,,,,,Y,,Y,Y,Y,,,Y
12376130955,Trustee for Solowiejczyk Charitable Foundation,VIC,3143,Medium,Y,,,,,,,,,Y,,,,,,,,,Y,,,,,,,,,,,Y,,,,,,,,,,
12486106821,FAIRFIELD-ALPHINGTON RSL SUB-BRANCH PATRIOTIC FUND,VIC,3000,Small,Y,,,,,Y,,,,,,,Y,Y,,,,,,,,,,,,,,,,,,,,,,,Y,,,
12487582597,SUNSHINE RSL SUB-BRANCH PATRIOTIC FUND,VIC,3000,Medium,Y,,,,,Y,,,,,,,Y,Y,,,,,,,,,,,,,,,,,,,,,,,Y,,,
12521055615,Hope Centre Incorporated,VIC,3046,Small,Y,,,,,,,,,,,Y,,,,Y,,Y,,,,,,Y,,Y,,,,,,,,,,,,,,
12566946365,The Australian Cartoon Museum Inc,VIC,3008,Small,Y,,,Y,Y,,,,,,,,,,,Y,Y,,,,,,,,,Y,,,,,Y,,,,,Y,,,,Y
12613637729,Gods Royal Assembly Inc,VIC,3036,Small,Y,,,,,,,,,,,Y,,,,Y,Y,Y,Y,Y,Y,Y,Y,Y,Y,Y,,Y,,Y,Y,Y,Y,Y,Y,Y,Y,Y,Y,Y
12624622836,The Trustee For The Anglican Diocese Of Melbourne Aborigines' Trust Fund,VIC,3000,Small,Y,,,,,,,,,,,Y,,,,,,,,,,,,,,Y,,,,,,,,,,,,,,
12627196249,Type 1 Diabetes Learning Centre Limited,VIC,3220,,Y,,,,,Y,,,,,,,,,,,,Y,,,,,,,,,,,,,,Y,,,,,,,,Y
12658058669,Newport RSL Sub-Branch Welfare Patriotic Fund,VIC,3000,Small,Y,,,,,,,,,,,,,,,,,,,,,,,,,,,,,,,,,,,,Y,,,
12659477973,Nagle College,VIC,3875,Large,Y,,,,Y,,,,,,,Y,,,,,,Y,,,,,,,,,,,,,,,,,,,,,,Y
12694715490,Big Love Foundation Inc,VIC,3564,,Y,,,,,,,,,,,,Y,,,,,,,,,,,,,,,,,,,,,,,,,,,
12716912401,Catholic Education Office Warragul,VIC,3820,Large,Y,,,,Y,,,,,,,Y,,,,,,Y,,Y,,,,,,,,,,,,,,,,,,,,Y
12725592873,MORWELL RSL SUB-BRANCH PATRIOTIC FUND,VIC,3000,Small,Y,,,,,Y,,,,,,,Y,Y,,,,,,,,,,,,,,,,,,,,,,,Y,,,
12768976538,St Bernadettes Catholic Church North Sunshine,VIC,3020,Medium,Y,,,,,,,,,,,Y,,,,,,,,,,,,,,Y,,,,,,,,,,,,,,
12781391829,Baha'i Community of Moreland,VIC,3056,Small,Y,,,,,,,,,,,Y,,,,,,,,,,,,,,Y,,,,,,,,,,,,,,
12794493795,WURRUK COMMUNITY HOUSE INC,VIC,3850,,Y,Y,,,,,,,,,,,Y,,,,,,,,,Y,Y,Y,,Y,Y,,Y,,,,,,Y,Y,,,,
12808897863,St Malachy's School,VIC,3318,Large,Y,,,,Y,,,,,,,Y,,,Y,,,Y,,,,,,,,,,,,,,,Y,,,,,,,Y
12831286797,Cornwall Units,VIC,3152,,,,,,,,,,,,,,,,,,Y,,,,,,,,,,,,,,,,,,,,,,,
12843173532,The Trustee for THE KOREA VETERANS RSL SUB BRANCH WELFARE PATRIOTIC FUND W514 TRUST,VIC,3000,Small,Y,,,,,,,,,,,,,,,,,,,,,,,,,,,,,,,,,,,,Y,,,
12845268429,Kindilan Foundation PTY LTD,VIC,3393,Medium,,,,,,,,,,Y,,,,,,,,,,,,,,,,,,,,,,,Y,,,,,,,
12849502186,ELF SQUAD INC,VIC,3215,,Y,Y,,,,,,,,,,,Y,,,,,,,,,,,,,,,,,,,,,,,,,,,
12863063082,Holy Spirit School-Thornbury East,VIC,3071,Large,Y,,,,Y,,,,,,,Y,,,,,,Y,,,,,,,,,,,,,,,Y,,,,,,,
12901071775,The Trustee For The Inner North Community Foundation Charitable Fund,VIC,3070,Medium,Y,,,,,,,,,,,,,,,,,,,,,,,,,Y,,,,,,,,,,,,,,
12985134979,South Camberwell Uniting Church Gospel Hall,VIC,3124,Small,Y,,,,,,,,,,,Y,,,,,,,,,,,,,,Y,,,,,,,,,,,,,,
12985332280,Amal Youssef Foundation Inc.,VIC,3021,,Y,Y,,,,,,,,,,,Y,,,,,,,,,,,,,,,,,,,,,,,,,,,
13037159114,Wonthaggi & District Elderly Citizens Homes Inc,VIC,3995,Large,Y,Y,,,,,,,,,,,,,Y,Y,Y,,,,Y,,Y,Y,Y,,Y,Y,,,Y,,Y,,Y,,Y,,,
13059671417,Hastings Seafarers Centre Inc,VIC,3915,Small,Y,,,,,,,,,,,Y,,,,Y,,,,,,,Y,,,,Y,,,,,,,,,,,,,
13062042951,U.A.M. Ministries,VIC,3016,Small,Y,,,,,,,,,,,,,,Y,,,,,,,,,,,,,,,,,,,,Y,,,,,
13070898648,GREEK ORTHODOX ARCHDIOCESE OF AUSTRALIA CONSOLIDATED TRUST PARISH OF ST JOHNS NORTH CARLTON,VIC,3054,Small,Y,,,,,,,,,,,,,,,,,,,,,,,,,Y,,,,,,,,,,,,,,
13083011858,Rippon Lea Endowment Fund Ltd,VIC,3802,,Y,,,Y,,,,,,,,,,,,,,,,,,,,,,Y,,,,Y,,,,,,,,,,
13100996768,St Peters College,VIC,3977,Large,Y,,,,Y,,,,,,,Y,,,,,,Y,,,,,,,,,,,,,,,,,,,,,,Y
13103896920,Engineers Without Borders Australia Ltd,VIC,3051,,Y,,,,,,,,,,,,Y,,Y,,,,Y,,,,,,,,,Y,,,,,,,,,,,,Y
13159400810,Beacon Community Connections Inc,VIC,3630,Small,Y,,,,,,,,,Y,,,Y,,,Y,,Y,,Y,,Y,Y,Y,,,Y,,,,Y,,,,Y,Y,,,,Y
13160688077,Australian National Development Index Limited,VIC,3053,Small,,,,,Y,,,,,,,,,,Y,Y,Y,Y,,Y,,,Y,,,Y,Y,,,,,,,,Y,,,,,Y
13171573522,COPTIC ORTHODOX PATRIARCHATEST GEORGE CHURCH INCORPORATED,VIC,3021,Large,Y,,,,,,,,,,,Y,,,,,,,,,,,Y,,,Y,Y,,,Y,,,,,Y,,,,,
13251497096,St Margaret's School Maribyrnong,VIC,3032,Large,Y,,,,Y,,,,,,,Y,,,,,,Y,,,,,,,,,,,,,,,Y,,,,,,,
13261703296,Good Shepherd Parish,VIC,3150,Small,Y,,,,,,,,,,,Y,,,,,,,,,,,,,,Y,,,,,,,,,,,,,,
13364203224,DERRINALLUM RSL SUB-BRANCH PATRIOTIC FUND,VIC,3000,Small,Y,,,,,,,,,,,,,,,,,,,,,,,,,,,,,,,,,,,,Y,,,
13369391128,Linger Longer Country Common Equity Rental Co-Operative Ltd,VIC,3730,Small,Y,,,,,,,,,,,,Y,,,,,,,,,,,,,Y,,,,,,,,,,,,,,
13389287007,Reach 4 Your Future Foundation Inc.,VIC,3144,Small,,Y,,,Y,,,,,,,,,,,,,Y,,,,,,,,,,,,,,,,,,,,,Y,
13392123611,Wirn Wirn Dook Common Equity Rental Housing Co-Operative Ltd,VIC,3860,Small,Y,,,,,,,,,Y,,,,,,,,,,,,,,,,Y,,,,,,,,,,,,,,
13401094420,The Mildura Life Saving Club Incorporated,VIC,3500,Small,,Y,,,,,,,,,,,Y,,,,,Y,,,,Y,Y,,,,Y,,,,,,,,,,,,,Y
13404468610,The Wishbone Foundation,VIC,3384,Small,,,,,,Y,,,,,,,Y,,,,,,,,,,,,,,,,,,,,,,,,,,,
13427301090,The Trustee For The Alan Missen Foundation,VIC,3004,Small,Y,,,,Y,,,,,,,,,,,,,,,,,,,,,Y,,,,,,,,,,,,,,
13491976166,Yoorooga Uniting Care,VIC,3152,,,,,,,,,,,,,,,,,,,,,,,,,,,,,,,,,,,,,,,,,
13572518089,Eastern Chinese Baptist Church,VIC,3178,Small,Y,,,,,,,,,,,Y,,,,Y,Y,Y,,Y,Y,Y,Y,,,Y,Y,Y,,,,,,,,,,,,Y
13572556430,The Trustee For New Hope Baptist Church Tax Deductible Fund,VIC,3130,,Y,,,,,,,,,,,,,,,,Y,Y,,,Y,,Y,,Y,,Y,Y,,,Y,Y,Y,Y,,Y,,Y,,Y
13580920155,Kollel Welfare Fund,VIC,3183,Medium,Y,,,,,,,,,,,,Y,,,,,,,,,Y,,Y,,Y,,,,Y,,,Y,,,Y,,,,
13586640898,St Mary Star Of The Sea Catholic Church West Melbourne,VIC,3003,Medium,Y,,,,,,,,,,,Y,,,,,,,,,,,,,,Y,,,,,,,,,,,,,,
13614240649,Path of the Horse Ltd.,VIC,3458,Small,Y,,,,,Y,,,,,,,,,,,,,,,,,,,,,,,,,,Y,Y,,Y,,Y,,,
13627351768,SWINBURNE INTERNATIONAL (HOLDINGS) PTY LTD,VIC,3122,Small,Y,,,,Y,,,,,,,,,,,,,,,,,,,,,Y,,,Y,,,,,,,,,,,
13628586699,Swinburne University Of Technology,VIC,3122,Large,Y,,,,Y,,,,,,,,,,,,,,,,,,,,,Y,,,,,,,,,,,,,,
13635328729,Nar Nar Goon Kindergarten Inc.,VIC,3812,Small,Y,,,,Y,,,,,,,,,,,,,,,Y,,,,,,,,,,,,,,,,,,,,
13647390369,"LUTHERAN EDUCATION VIC, NSW, TAS AND ACT LTD",VIC,3128,,Y,,,,Y,,,,,,,,,,,,,Y,,Y,,,,,,Y,,,,,,,,,,,,,,Y
13782437760,NATHALIA / PICOLA RSL SUB-BRANCH PATRIOTIC FUND,VIC,3000,Small,Y,,,,,Y,,,,,,,Y,Y,,,,,,,,,,,,,,,,,,,,,,,Y,,,
13782504542,Om Australia Inc,VIC,3130,Medium,Y,Y,,,,Y,,,Y,,,,Y,,,,,,Y,,Y,,Y,,,,Y,Y,,,Y,Y,Y,,,Y,,,Y,
13826730655,S S Peter & Pauls Church School East Doncaster,VIC,3109,Large,Y,,,,Y,,,,,,,Y,,,,,,Y,,,,,,,,,,,,,,,Y,,,,,,,
13831223801,Bunyip District Uniting Church,VIC,3818,Small,Y,,,,,,,,,,,Y,,,,,Y,,,,,,,Y,,Y,,,,,,,,,Y,,,,Y,
13863858517,Fishcare Victoria Inc,VIC,3909,Medium,Y,,,,,,,Y,,,,,Y,,Y,Y,Y,Y,,,Y,Y,Y,,Y,,Y,Y,,,,,,,Y,,,,,Y
13864365340,Our Lady Of Perpetual Help Catholic Church Dromana,VIC,3936,Small,Y,,,,,,,,,,,Y,,,,,,,,,,,,,,Y,,,,,,,,,,,,,,
13941301262,Our Lady of the Southern Cross Catholic Primary School,VIC,3024,Large,Y,,,,Y,,,,,,,Y,,,,,,Y,,,,,,,,,,,,,,,Y,,,,,,,
13945116902,Ellimatta Youth Inc.,VIC,3763,Small,Y,,,,,,,,,,,,Y,,,,,Y,,,,,Y,,,,Y,,,,,,,,Y,,,,,Y
13963187316,Murtoa RSL Sub-Branch Patriotic Fund,VIC,3000,Small,Y,,,,,Y,,,,,,,Y,Y,,,,,,,,,,,,,,,,,,,,,,,Y,,,
14003280080,St Brendans School Flemington,VIC,3031,Large,Y,,,,Y,,,,,,,Y,,,,,,Y,,,,,,,,,,,,,,,Y,,,,,,,
14031247916,UPPER YARRA RSL SUB-BRANCH PATRIOTIC FUND,VIC,3000,Small,Y,,,,,Y,,,,,,,Y,Y,,,,,,,,,,,,,,,,,,,,,,,Y,,,
14051912647,Montrose Environmental Group Inc,VIC,3765,Small,Y,,,,,,,Y,,,,,,,,,,,,,,,,,,,,,,,,,,,,,,,,
14054063570,Mirboo North Kindergarten Incorporated,VIC,3871,Small,Y,,,,,,,,,,,,Y,,,,,,,Y,,,,,,,,,,,,,,,,,,,,
14086133457,St Marys Catholic Parish Seymour,VIC,3660,Small,Y,,,,,,,,,,,Y,,,,,,,,,,,,,,Y,,,,,,,,,,,,,,
14104820346,Australia Alopecia Areata Foundation Inc.,VIC,3199,Small,,,,,,Y,,,,,,,,,,Y,Y,Y,,Y,,Y,,,,,,,,,,Y,,,,,,,,Y
14107318915,Girgarre RSL Sub-Branch Welfare Patriotic Fund,VIC,3000,Small,Y,,,,,,,,,,,,,,,,,,,,,,,,,,,,,,,,,,,,Y,,,
14130934497,Anglican Trusts Corporation Of The Diocese Of Gippsland,VIC,3898,Small,Y,,,,,,,,,,,Y,,,,,,,,,,,,,,Y,,,,,,,,,,,,,,
14152519842,Threeseas Community Culture Confidence Inc.,VIC,3174,Small,Y,,,Y,,,,,,,,,Y,,Y,Y,Y,Y,,Y,Y,Y,,Y,Y,Y,,Y,Y,,Y,,Y,Y,,Y,,Y,Y,Y
14153265965,St Marys Catholic Church Ascot Vale,VIC,3032,Small,Y,,,,,,,,,,,Y,,,,,,,,,,,,,,Y,,,,,,,,,,,,,,
14196818677,Traralgon And District Baptist Church,VIC,3844,Small,Y,,,,,,,,,,,Y,,,,,,,,,,,,,,Y,,,,,,,,,,,,,,
14203183344,MELBOURNE HEBREW CONGREGATION MUSEUM INC,VIC,3141,Small,Y,,,Y,,,,,,,,,,,,,,,,,,,,,,Y,,,,,,,,,,,,,,
14221923434,The Trustee For R H S Abbott Estate,VIC,3001,Medium,Y,,,Y,,,,,,,,,,,,,,,,,,,,,,,,,,Y,,,,,,,,,,
14224492748,BAIRNSDALE RSL SUB-BRANCH PATRIOTIC FUND,VIC,3000,Small,Y,,,,,Y,,,,,,,Y,Y,,,,,,,,,,,,,,,,,,,,,,,Y,,,
14234892349,Warrnambool RSL Sub-Branch Welfare Patriotic Fund,VIC,3000,Small,Y,,,,,,,,,,,,,,,,,,,,,,,,,,,,,,,,,,,,Y,,,
14251611586,Charles Wright Charitable Trust -  Royal Children's Hospital Account,VIC,3001,Small,Y,,,,,Y,,,,,,,,,,,,,,,,,,,,,,,,Y,,,,,,,,,,
14296419971,Tongala Rsl Sub Branch,VIC,3621,Small,Y,,,,,,,,,Y,,,,,,,,,,,,,,,,,,,,,,,,,,,Y,,,
14307634388,Warragul Heritage Preservation Association Inc,VIC,3820,Small,Y,,,,,,,,,Y,,,,,,,,,,,,,,,,Y,,,,,,,,,,,,,,
14317155857,Katharine St Clair Nanson Charitable Trust - Melbourne Anglican Trust Corporation Account,VIC,3001,Small,Y,,,,,,,,,,,,Y,,,,,,,,,,,,,,,,,Y,,,,,,,,,,
14327919483,Boort Church Of Christ,VIC,3537,Small,Y,,,,,,,,,,,Y,,,,Y,Y,,,,,Y,Y,,,Y,Y,,,,,,,,Y,,,,,
14374661392,Stretton Park Incorporated,VIC,3860,Large,Y,Y,,,,,,,,,,,,,Y,,Y,,,,Y,,Y,Y,Y,,Y,,,,Y,Y,Y,,Y,,Y,,,
14393986507,Euroa Arboretum,VIC,3666,,Y,,,,,,,Y,,,,,,,,,,,,,,,,,,,,,,,,,,,,,,,,
14394632315,Pyramid Hill Neighbourhood House Inc,VIC,3575,Small,Y,,,,,,,,,Y,,,,,,Y,Y,,,,Y,,,Y,,,,Y,,,,,Y,,Y,Y,,,,Y
14463973461,Bendigo Diocesan Trusts Corportation,VIC,3552,Small,Y,,,,,,,,,,,Y,,,,,,,,,,,,,,Y,,,,,,,,,,,,,,
14491017881,Broadford And District Historical Society Inc,VIC,3658,Small,Y,,,Y,,,,,,Y,,,Y,,,Y,Y,Y,,,,,,,,Y,,,,,,,,,Y,,,,,Y
14495154157,Valley Common Equity Rental Housing Cooperative Ltd,VIC,3841,Small,Y,,,,,,,,,Y,,,,,,,,,,,,,,,,Y,,,,,,,,,,,,,,
14541297399,Theo Murphy Fund,VIC,3000,Medium,,,,,,Y,,,,,,,Y,,,,,,,,,,,,,Y,,,,,,,,,,,,,,
14565507323,Port Fairy Surf Lifesaving Club Inc A1412Z,VIC,3284,Small,Y,Y,,,,,,,,,,,,,,Y,Y,Y,,,,Y,Y,,,,Y,,,,,,Y,,,,,,,Y
14581826760,Albert Park And Port Melbourne Baptistchurch,VIC,3206,Small,Y,,,,,,,,,,,Y,,,,,,,,,,Y,Y,Y,,,Y,,,,Y,,,,,Y,,,,
14591826647,St Patrick's Primary School Wangaratta,VIC,3677,Large,Y,,,,Y,,,,,,,Y,,,,,,Y,,,,,,,,,,,,,,,,,,,,,,
14661290087,Australian Free Church,VIC,3130,Small,Y,,,,,,,,,,,Y,,,,,,,,,,Y,,,,Y,,,,,,,,,,,,,,
14667703365,Wheatland District Church Inc,VIC,3393,Small,Y,,,,,,,,,,,Y,,,,,,,,,,Y,Y,,,Y,Y,,,,,,,,,,,,,
14671840186,Alzheimer's Australia Vic Ltd,VIC,3122,Large,Y,Y,,,,,,,,,,,Y,,,,Y,,,,,Y,Y,,,Y,Y,,,,,,,,,,,,,
14679778375,Thomson River Common Equity Rental Housing Co-Operative Ltd ,VIC,3850,Medium,Y,,,,,,,,,Y,,,,,,,,,,,,,,,,Y,,,,,,,,,,,,,,
14683365589,WARRNAMBOOL RSL SUB-BRANCH PATRIOTIC FUND,VIC,3000,Medium,Y,,,,,,,,,Y,,,,,,,,,,,,,,,,,,,,,,,,,,,Y,,,
14731775051,The Trustee For Hussey Burgh Macartney Gift,VIC,3000,Small,Y,,,,,,,,,,,Y,,,,,,,,,,,,,,Y,,,,,,,,,,,,,,
14746945190,Saint Patricks Catholic Cathedral,VIC,3002,Medium,Y,,,,,,,,,,,Y,,,,,,,,,,,,,,Y,,,,,,,,,,,,,,
14754491689,Avoca RSL Sub-Branch Welfare Patriotic Fund,VIC,3000,Small,Y,,,,,,,,,,,,,,,,,,,,,,,,,,,,,,,,,,,,Y,,,
14784342604,Lilydale Congregation of Jehovah's Witnesses,VIC,3796,Small,Y,,,,,,,,,,,Y,,,,,,,,,,,,,,Y,,,,,,,,,,,,,,
14788243413,The Trustee For The Anzsog Foundation,VIC,3053,Medium,Y,,,,Y,,,,,,,,,,,,,,,,,,,,,,,,Y,,,,,,,,,,,
14819737541,Rachel Madga Hornung Charitable Trust,VIC,3185,Small,,,,,,,,,,Y,,,,,,,,,,,,,,,,,,,,,,,,,,,,,,
14898097611,Holy Trinity Oakleigh - Choir Fund,VIC,3000,Small,Y,,,,,,,,,,,Y,,,,,,,,,,,,,,Y,,,,,,,,,,,,,,
14955698028,Mukti Australia Inc,VIC,3153,,Y,Y,,,,,,,,,,,,,,,Y,Y,,,,,Y,,,,,,,,,,Y,,,,,,,
14992892721,Millgrove Baptist Church,VIC,0,Small,Y,,,,,,,,,,,Y,,,,Y,Y,,,,,Y,,Y,,Y,,,,,,,,,,,,,,
15007966474,Uca - Castlemaine,VIC,3450,Small,Y,,,,,,,,,,,Y,,,,,,,,,,Y,,Y,,Y,,,,,,,,,,,,,,
15017051337,GREEK ORTHODOX ARCHDIOCESE OF AUSTRALIA CONSOLIDATED TRUST PARISH OF ST HARALAMBOS HALL SUB ENTITY,VIC,3106,Small,Y,,,,,,,,,,,,,,,,,,,,,,,,,Y,,,,,,,,,,,,,,
15025014933,Stockaders Common Equity Rental Housing Co-operative Ltd,VIC,3350,Small,Y,,,,,,,,,,,,Y,,,,,,,,,,,,,Y,,,,,,,,,,,,,,
15079588570,La Trobe University Student Union Inc.,VIC,3086,Large,Y,,,,,,,,,,,,,,,Y,,,,,,,,Y,,Y,,,Y,,Y,,Y,,,Y,,,,Y
15108331657,Fiona Elsey Cancer Research Institute,VIC,3350,Large,,,,,,Y,,,,,,,,,,,,,,,,,,,,,,,,,,Y,,,,,,,,
15125270313,Sports Health Check Australia,VIC,3040,Small,Y,,,,,Y,,,,,,,,,,,,Y,,,Y,,,Y,,,,,,,,,,,,,,,,Y
15155873457,IAESTE Australia Ltd.,VIC,3168,,Y,,,,Y,,,,,,,,,,,,,,,,,,,,,,,,Y,,,,,,,,,,,Y
15163026097,m.a.d.woman Foundation Limited,VIC,3181,Small,Y,Y,,,,,,,,,,,,,Y,Y,Y,Y,,Y,Y,Y,Y,Y,Y,Y,Y,Y,,Y,Y,Y,Y,,Y,,,,,Y
15188606913,St Patricks Primary School,VIC,3478,Large,Y,,,,Y,,,,,,,Y,,,Y,,,Y,,,,,,,,,,,,,,,Y,,,,,,,Y
15243237799,The Trustee For The Rotary Club Of Balwyn Education Foundation,VIC,3103,Small,Y,,,,Y,,,,,,,,,,Y,,,,,,,,,,,,,,,,,,,,,,,,,
15254589982,Charles Wright Charitable Trust -  Royal Melbourne Hospital Account,VIC,3001,Small,Y,,,,,Y,,,,,,,,,,,,,,,,,,,,,,,,Y,,,,,,,,,,
15259238529,Glenroy Oak Park Baptist Church,VIC,3046,Small,Y,,,,,,,,,,,Y,,,,,,,,,,,,,,Y,,,,,,,,,,,,,,
15356252299,St Francis Xavier Catholic Church Montmorency,VIC,3094,Medium,Y,,,,,,,,,,,Y,,,,,,,,,,,,,,Y,,,,,,,,,,,,,,
15357214547,Foundation In Religious Education,VIC,3170,Small,Y,,,,Y,,,,,,,,,,,,,Y,,,,,,,,Y,,,,,,,,,,,,,,
15411702545,Anglican Trusts Corporation Of The Diocese Of Gippsland,VIC,3960,Small,Y,,,,,,,,,,,Y,,,,,,,,,,,,,,Y,,,,,,,,,,,,,,
15446301992,Broadmeadows Community Toy Library Inc,VIC,3047,Small,Y,,,,,,,,,,,,Y,,,,,,,Y,Y,Y,,Y,,,,Y,,,,,Y,,,,,,,
15457928360,1st Serbian RSL Sub-Branch Welfare Patriotic Fund,VIC,3000,Small,Y,,,,,,,,,,,,,,,,,,,,,,,,,,,,,,,,,,,,Y,,,
15465827307,The Trustee For The Clausing J M Estate,VIC,3001,Small,,,,,,,,,,Y,,,,,,,,,Y,,,,,,,,,,,,,,,,,,,,,
15467279810,"The Redeemed Christian Church of God ""King's Court Parish""",VIC,3058,Small,Y,,,,,,,,,,,Y,,,,,,,,,,,Y,,,Y,Y,,,,,,,,,,,,,
15482454134,Newhope Baptist Church School Building Fund,VIC,3130,,Y,,,,Y,,,,,,,,,,,,,Y,,,Y,,,,,,,Y,,,,,Y,,,,,,,
15490012190,Mornington Mens Shed Incorporated,VIC,3931,Small,Y,,,,,Y,,,,,,,,,,,Y,,,Y,,,Y,,,Y,Y,,,,,,Y,,,,Y,,,
15557421367,Disability Advocacy Victoria Inc,VIC,3204,Small,,,,,,,,,Y,,,,,,,,,,,,,,,,,,,,,,,,Y,,,,,,,
15562601404,The trustee for The Salvation Army Aust Self Denial Fund (for Overseas Aid),VIC,3130,Large,Y,,,,,,,,,,,,Y,,,,,,Y,,,,,,,,,,,,,,,,,,,,,
15589254033,Uca-Kangaroo Flat,VIC,3555,Small,Y,,,,,,,,,,,Y,,,,,,,,,,,,,,Y,,,,,,,,,,,,,,
15605721462,Australian Christian Dental Aid Limited,VIC,3149,Small,Y,Y,,,,Y,,,,,,,Y,,,,,,Y,,,,,,,,,,,,,,,,,,,,,
15609317937,Sleep Bus Limited,VIC,3015,Small,Y,Y,,,,,,,,,,,Y,Y,,Y,,,,,,,Y,,,,Y,,,,Y,,,,,,,,,Y
15616823559,Lorne & District Men's Shed Inc,VIC,3232,Small,Y,,,,,Y,,,,,,,Y,,,Y,Y,,,,,,,,,Y,Y,,,,,,,,Y,,,,,
15625886946,VOICE Australia Ltd,VIC,3012,,Y,,,,,,Y,,Y,,,,Y,,,,,,Y,,Y,,,,,,,Y,,,,,,,,,,,Y,
15636198284,The Trustee For Australian Unity Foundation,VIC,3000,Small,,,,,,,,,,Y,,,,,Y,,,,,,,,,Y,,Y,,,,Y,,,,,,,,,,
15637705856,Network West,VIC,3015,Small,Y,,,,,,,,,,,,Y,,Y,Y,Y,,,,Y,,,Y,Y,,,Y,,Y,Y,Y,,,,Y,,,,Y
15643617323,PANDIS LIMITED,VIC,3000,,Y,,,,Y,Y,,,,,,,,,Y,Y,Y,Y,Y,Y,Y,Y,Y,Y,Y,Y,Y,Y,,Y,Y,Y,Y,Y,Y,Y,Y,,Y,Y
15766927171,The Trustee For Berwick Education Trust,VIC,3809,Large,Y,,,,Y,,,,,,,,,,,,,,,,,,Y,,,Y,Y,,,,,Y,Y,,,Y,,,,
15768597240,St Francis Of The Fields Primary School,VIC,3551,Large,Y,,,,Y,,,,,,,Y,,,,,,Y,,,,,,,,,,,,,,,,,,,,,,
15782072740,Murray Valley Centre For The Intellectually Handicapped Inc,VIC,3690,Large,Y,Y,,,,,,,,,,,,,,Y,Y,,,,,,,,,,,,,,,,Y,,,,,,,Y
15791335284,CAMBERWELL CITY RSL SUB-BRANCH PATRIOTIC FUND,VIC,3000,Small,Y,,,,,,,,,,,,,,,,,,,,,,,,,,,,,,,,,,,,Y,,,
15805683511,St Patricks Primary School Geelong West,VIC,3218,Large,Y,,,,Y,,,,,,,Y,,,,,,Y,,,,,,,,,,,,,,,Y,,,,,,,
15812156410,CATHOLIC PARISH OF MERNDA/WHITTLESEA,VIC,3754,Medium,Y,,,,,,,,,,,Y,,,,,,,,,,,,,,Y,,,,,,,,,,,,,,
15829757639,Gardiner Retirement Lodge,VIC,3152,,Y,,,,,,,,,,,,,,,,Y,,,,,,,,,,,,,,,,,,,,,,,
15841863084,Crawford Court,VIC,3152,,,Y,,,,,,,,,,,,,,,Y,,,,,,,,,,,,,,,,,,,,,,,
15856706183,LOCH SPORT RSL SUB-BRANCH PATRIOTIC FUND,VIC,3000,Small,Y,,,,,Y,,,,Y,,,Y,Y,,,,,,,,,,,,,,,,,,,,,,,Y,,,
15865086524,OCEAN GROVE BARWON HEADS RSL SUB-BRANCH PATRIOTIC FUND,VIC,3000,Small,Y,,,,,,,,,,,,,,,,,,,,,,,,,,,,,,,,,,,,Y,,,
15869452241,Woodleigh School Development Inc,VIC,3911,Small,Y,,,,Y,,,,,,,,,,Y,,,Y,,Y,,,,,,Y,,,,,,,,,,,,,,Y
15869788315,RESERVOIR RSL SUB-BRANCH PATRIOTIC FUND,VIC,3000,Medium,Y,,,,,Y,,,,,,,Y,Y,,,,,,,,,,,,,,,,,,,,,,,Y,,,
15874546109,Uca-St Annes Riddells Creek,VIC,3429,Small,Y,,,,,,,,,,,,,,,,,,,,,,,,,Y,,,,,,,,,,,,,,
15880017475,Uca The Uniting Church In Australia Presbytery Of Gippsland,VIC,3862,Medium,Y,,,,,,,,,,,Y,,,,,,,,,,Y,Y,,,Y,Y,,,,,,,,Y,,,,,
15908232092,Port Fairy RSL Sub-Branch Patriotic Fund,VIC,3000,Small,Y,,,,,Y,,,,,,,Y,Y,,,,,,,,,,,,,,,,,,,,,,,Y,,,
15935542095,St Josephs Catholic Church Black Rock,VIC,3193,Small,Y,,,,,,,,,,,Y,,,,,,,,,,,,,,Y,,,,,,,,,,,,,,
15968949131,U3A Waverley Inc,VIC,3148,Small,Y,,,,Y,,,,,,,,,,,,Y,,,,,,,,,,,,,,,,,,,,,,,
15974642842,Metcalfe And District Senior Citizens Inc,VIC,3448,Small,Y,,,,,,,,,,,,,,,,Y,,,,,,,,,,,,,,,,,,,,,,,
15998336276,St Josephs School Chiltern,VIC,3683,Large,Y,,,,Y,,,,,,,,,,,,,Y,,,,,,,,,,,,,,,,,,,,,,
16003166154,St Marys School Sea Lake,VIC,3533,Large,Y,,,,Y,,,,,,,Y,,,Y,,,Y,,,,,,,,,,,,,,,Y,,,,,,,Y
16005363646,Australian Ballet Centre Pty. Ltd.,VIC,3006,Large,Y,,,,,,,,,,,,,,,,,,,,,,,,,Y,,,,,,,,,,,,,,
16007386259,The Trustee For Cohuna Secondary College Chaplaincy Foundation,VIC,3568,Small,,,,,Y,,,,,,,,,,,,,,,,,,,,,,,,,,,,,,,,,,,
16064798282,UCA - St Andrews Portarlington,VIC,3223,Small,Y,,,,,,,,,,,Y,,,,,,,,,,,,,,Y,,,,,,,,,,,,,,
16070575440,Belgrave South Community House,VIC,3160,Medium,Y,,,,,,,Y,,Y,,,Y,,,,,,,,,,,,,Y,,,,,,,,,,,,,,
16096549003,Life For All Creatures Ltd.,VIC,3788,Small,Y,,Y,,,,,,,,,,,,,,,,,,,,,,,,,,,,,,,,,,,,,
16127632989,HIGHETT RSL SUB-BRANCH PATRIOTIC FUND,VIC,3000,Small,Y,,,,,Y,,,,Y,,,Y,Y,,,,,,,,,,,,,,,,,,,,,,,Y,,,
16134292103,College Of Intensive Care Medicine Of Australia And New Zealand,VIC,3181,Large,Y,,,,Y,,,,,,,,,,,,,,,,,,,,,Y,,,,,,,,,,,,,,
16181042662,Jellis Craig Charitable Fund,VIC,3000,Small,Y,,,,,,,,,,,,Y,,,,,,,,,Y,,Y,,,,,,,Y,,,,,,,,,
16197755289,Kingsville St Pauls Walmsley,VIC,3000,Small,Y,,,,,,,,,,,Y,,,,,,,,,,,,,,Y,,,,,,,,,,,,,,
16216748925,Presence International House Churches Inc,VIC,3156,Small,Y,,,,,,,,,,,Y,,,,Y,,,,,Y,Y,Y,Y,,Y,Y,,,,Y,,,,,,,,,
16322157622,ORPHAN AND WIDOW CARE INITIATIVES FOR AFRICA INC,VIC,3029,Small,,,,,,,,,,,,,,,,,,,,,,,,,,,,,,,,,,,,,,,,
